,Unnamed: 0,3P_x,3PA_x,AST_x,BLK_x,FG_x,FGA_x,FT_x,FTA_x,ORB_x,DRB_x,PF_x,PTS_x,STL_x,TOV_x,TRB_x,Team_Win_x,opp_TRB_x,opp_3P_x,opp_3PA_x,opp_AST_x,opp_BLK_x,opp_FG_x,opp_FGA_x,opp_FT_x,opp_FTA_x,opp_PTS_x,opp_ORB_x,opp_DRB_x,opp_STL_x,opp_PF_x,opp_TOV_x,Team_x,Game_Id,Date_x,Days_Since_x,team_location_x,distance_From_Home_x,team_time_zone_x,time_zone_diff_x,last_loc_x,distance_From_Last_Game_x,last_time_zone_x,time_zone_change_x,game_number_x,played_yesterday_x,played_diff_loc_yesterday_x,back_to_back_road_games_x,first_x,eFG%_x,TOV%_x,opp_eFG%_x,opp_TOV%_x,ORB%_x,opp_ORB%_x,FT_factor_x,opp_FT_factor_x,DRB%_x,opp_DRB%_x,3P_y,3PA_y,AST_y,BLK_y,FG_y,FGA_y,FT_y,FTA_y,ORB_y,DRB_y,PF_y,PTS_y,STL_y,TOV_y,TRB_y,Team_Win_y,opp_TRB_y,opp_3P_y,opp_3PA_y,opp_AST_y,opp_BLK_y,opp_FG_y,opp_FGA_y,opp_FT_y,opp_FTA_y,opp_PTS_y,opp_ORB_y,opp_DRB_y,opp_STL_y,opp_PF_y,opp_TOV_y,total_PTS,is_Home_y,Team_y,Date_y,Days_Since_y,game_Location,team_location_y,distance_From_Home_y,game_time_zone,team_time_zone_y,game_hour (et),time_zone_diff_y,last_loc_y,distance_From_Last_Game_y,last_time_zone_y,time_zone_change_y,game_number_y,result,played_yesterday_y,played_diff_loc_yesterday_y,back_to_back_road_games_y,first_y,eFG%_y,TOV%_y,opp_eFG%_y,opp_TOV%_y,ORB%_y,opp_ORB%_y,FT_factor_y,opp_FT_factor_y,DRB%_y,opp_DRB%_y,Home Opener,Home Closing Line,Visitor Juice,Home Juice,Opening Total,Closing Total,Over Juice,Under Juice,Visitor ML Open,Visitor ML,Home ML Open,Home ML
19,19,5.34782608696,14.7826086957,22.2608695652,6.17391304348,37.5217391304,81.8260869565,16.4782608696,22.4347826087,13.3913043478,31.8695652174,17.3913043478,96.8695652174,7.30434782609,13.652173913,45.2608695652,1,39.7826086957,4.69565217391,13.2608695652,19.0434782609,4.78260869565,34.4782608696,81.0,13.7826086957,19.2173913043,87.4347826087,11.3043478261,28.4782608696,7.17391304348,18.1304347826,13.8260869565,Chicago,1/30/2012_Washington_Chicago,2012-01-30,2.0,Washington DC,0.0,2,1,Miami,,3.0,0.0,23,True,True,False,0,0.491232731137,0.129589276281,0.454643048846,0.133867681479,0.319833852544,0.261832829809,0.201381509033,0.170155662909,0.738167170191,0.680166147456,3.85714285714,13.3333333333,17.5238095238,7.90476190476,34.8571428571,83.2380952381,15.2380952381,20.9523809524,11.619047619,30.0952380952,21.1428571429,88.8095238095,8.7619047619,15.1904761905,41.7142857143,0,45.380952381,6.33333333333,17.5714285714,22.7142857143,5.19047619048,37.0476190476,81.2380952381,17.8095238095,24.5238095238,98.2380952381,12.4761904762,32.9047619048,7.80952380952,18.2857142857,15.5238095238,187.047619048,1,Washington,2012-01-30,1.0,Washington DC,Washington DC,0.0,3,3,19,0,Charlotte,,3.0,0.0,21,-10,False,False,False,1,0.441933638444,0.141112978855,0.495017584994,0.144337200035,0.260962566845,0.293064876957,0.183066361556,0.219226260258,0.706935123043,0.739037433155,9.0,9.0,-101.0,-109.0,190.5,189.5,-103.0,-107.0,-450.0,-490.0,385.0,416.0
20,20,5.41666666667,14.875,22.25,6.125,37.2916666667,81.5,16.25,22.1666666667,13.1666666667,31.75,17.2916666667,96.25,7.20833333333,13.7916666667,44.9166666667,0,39.9166666667,4.66666666667,13.1666666667,19.3333333333,4.75,34.7083333333,81.125,13.7916666667,19.2083333333,87.875,11.2916666667,28.625,7.29166666667,17.9583333333,13.6666666667,Chicago,2/1/2012_Philadelphia_Chicago,2012-02-01,2.0,Philadelphia,0.0,2,1,Washington DC,,3.0,0.0,24,False,False,False,0,0.490797546012,0.131292937947,0.456599897278,0.13237335744,0.315054835494,0.262342691191,0.199386503067,0.170005136107,0.737657308809,0.684945164506,6.22727272727,16.2727272727,22.4090909091,4.81818181818,38.5,82.7727272727,14.2727272727,19.7272727273,9.5,34.2272727273,17.4090909091,97.5,9.13636363636,10.8636363636,43.7272727273,1,43.6818181818,4.59090909091,15.5454545455,18.1818181818,4.59090909091,33.7272727273,81.3181818182,13.8636363636,19.3636363636,85.9090909091,11.3181818182,32.3636363636,5.95454545455,17.4090909091,14.4090909091,183.409090909,1,Philadelphia,2012-02-01,2.0,Philadelphia,Philadelphia,0.0,3,3,19,0,Philadelphia,0.0,3.0,0.0,22,16,False,False,False,1,0.502745744097,0.10617692007,0.44298490777,0.138220315334,0.226927252986,0.248502994012,0.17243272927,0.170486305198,0.751497005988,0.773072747014,1.5,2.0,-104.0,-106.0,181.5,178.0,-104.0,-106.0,-123.0,-123.0,111.0,111.0
21,21,5.44,14.76,22.24,6.24,37.36,81.2,16.44,22.44,13.0,31.6,17.2,96.6,7.32,13.8,44.6,1,39.8,4.64,13.28,19.36,4.64,35.08,81.48,13.64,19.0,88.44,11.36,28.44,7.28,18.16,13.68,Chicago,2/2/2012_New York_Chicago,2012-02-02,2.0,New York,0.0,2,1,Philadelphia,,3.0,0.0,25,True,True,False,0,0.493596059113,0.131586977085,0.459008345606,0.132148377125,0.313706563707,0.264432029795,0.202463054187,0.167403043692,0.735567970205,0.686293436293,7.22727272727,23.1818181818,18.9090909091,4.22727272727,34.2272727273,80.5909090909,19.2727272727,24.7272727273,10.8636363636,30.8181818182,22.4090909091,94.9545454545,9.5,16.0454545455,41.6818181818,0,42.5909090909,6.36363636364,16.2727272727,19.8636363636,5.18181818182,35.5454545455,78.5909090909,18.1363636364,25.0454545455,95.5909090909,9.77272727273,32.8181818182,8.36363636364,21.6363636364,16.4545454545,190.545454545,1,New York,2012-02-02,1.0,New York,New York,0.0,3,3,19,0,New York,0.0,3.0,0.0,22,-3,False,False,False,1,0.469543147208,0.149237325397,0.492770387507,0.155135765222,0.248699271592,0.240761478163,0.239142695995,0.230769230769,0.759238521837,0.751300728408,3.5,3.5,-105.0,-105.0,190.0,189.0,100.0,-110.0,-166.0,-163.0,150.0,147.0
22,22,5.76923076923,15.3461538462,22.5769230769,6.15384615385,37.7692307692,81.5384615385,15.9230769231,21.7307692308,12.9230769231,32.0,17.3076923077,97.2307692308,7.26923076923,13.7692307692,44.9230769231,1,39.7692307692,4.5,13.2307692308,19.1923076923,4.65384615385,35.1538461538,81.9230769231,13.6923076923,19.0,88.5,11.4230769231,28.3461538462,7.23076923077,17.7692307692,13.4615384615,Chicago,2/4/2012_Milwaukee_Chicago,2012-02-04,1.0,Milwaukee,0.0,2,0,New York,,3.0,-1.0,26,False,False,False,0,0.49858490566,0.131299053767,0.456572769953,0.129756502654,0.313140726934,0.26306465899,0.195283018868,0.167136150235,0.73693534101,0.686859273066,6.34782608696,20.0,21.2173913043,4.65217391304,35.9565217391,83.6956521739,15.652173913,20.0434782609,11.7391304348,29.0,20.0434782609,93.9130434783,8.08695652174,14.1739130435,40.7391304348,0,44.5217391304,6.13043478261,18.2173913043,21.0869565217,5.13043478261,35.2608695652,79.347826087,18.5217391304,24.3913043478,95.1739130435,11.7826086957,32.7391304348,7.95652173913,19.3043478261,16.0,189.086956522,1,Milwaukee,2012-02-04,2.0,Milwaukee,Milwaukee,0.0,2,2,20,0,Detroit,,3.0,-1.0,23,-23,True,True,False,1,0.467532467532,0.13285299775,0.48301369863,0.150829562594,0.263929618768,0.288912579957,0.187012987013,0.233424657534,0.711087420043,0.736070381232,4.5,5.0,-105.0,-105.0,191.0,186.5,-101.0,-109.0,-195.0,-194.0,175.0,174.0
23,23,5.82142857143,15.3571428571,23.0357142857,5.82142857143,37.8928571429,81.3214285714,15.75,21.4285714286,12.75,32.1071428571,17.3928571429,97.3571428571,7.46428571429,13.6785714286,44.8571428571,1,39.6428571429,4.32142857143,13.0,19.1785714286,4.5,34.7857142857,81.5714285714,13.7857142857,19.1785714286,87.6785714286,11.4642857143,28.1785714286,7.03571428571,17.6428571429,13.5357142857,Chicago,2/8/2012_New Orleans_Chicago,2012-02-08,2.0,New Orleans,0.0,2,0,Newark,,3.0,-1.0,28,False,False,False,0,0.501756697409,0.13098495212,0.452933450088,0.130722110317,0.311518324607,0.263114754098,0.193675889328,0.169001751313,0.736885245902,0.688481675393,3.57692307692,12.0,19.3461538462,4.96153846154,34.3461538462,78.0,14.8846153846,20.0384615385,11.3846153846,30.0384615385,20.3846153846,87.1538461538,7.19230769231,14.4615384615,41.4230769231,0,39.7307692308,6.15384615385,19.0769230769,20.1538461538,5.34615384615,34.6153846154,76.6538461538,17.9230769231,23.1153846154,93.3076923077,9.69230769231,30.0384615385,7.57692307692,18.0,13.0769230769,180.461538462,1,New Orleans,2012-02-08,2.0,New Orleans,New Orleans,0.0,2,2,21,0,New Orleans,0.0,2.0,0.0,26,-23,False,False,False,1,0.463264299803,0.142789871033,0.491721023583,0.130898115067,0.274837511606,0.243949661181,0.190828402367,0.233818364275,0.756050338819,0.725162488394,9.0,10.0,102.0,-113.0,182.0,181.0,-110.0,100.0,-450.0,-550.0,385.0,461.0
24,24,5.8275862069,15.3448275862,23.0,5.75862068966,37.9310344828,81.6206896552,15.5862068966,21.3793103448,12.9310344828,32.2068965517,17.3103448276,97.275862069,7.55172413793,13.5517241379,45.1379310345,1,39.7931034483,4.20689655172,12.8275862069,19.1034482759,4.51724137931,34.4482758621,81.3793103448,13.7586206897,19.1724137931,86.8620689655,11.4137931034,28.3793103448,6.96551724138,17.6551724138,13.6206896552,Chicago,2/10/2012_Charlotte_Chicago,2012-02-10,3.0,Charlotte,0.0,2,1,New Orleans,,2.0,1.0,29,False,False,False,0,0.500422475708,0.129583223424,0.449152542373,0.131682468563,0.313021702838,0.261660079051,0.190959019856,0.16906779661,0.738339920949,0.686978297162,4.11538461538,13.6923076923,19.2692307692,5.61538461538,33.8461538462,81.2307692308,14.5,19.7692307692,10.4615384615,30.0,19.1923076923,86.3076923077,5.88461538462,14.3076923077,40.4615384615,0,44.8076923077,6.46153846154,17.7307692308,23.1153846154,5.84615384615,38.7692307692,82.5769230769,16.5384615385,22.3076923077,100.538461538,11.3846153846,33.4230769231,7.80769230769,18.8076923077,13.1153846154,186.846153846,1,Charlotte,2012-02-10,2.0,Charlotte,Charlotte,0.0,3,3,20,0,Boston,,3.0,0.0,26,-31,False,False,False,1,0.441998106061,0.137261268707,0.508616674429,0.124307378244,0.238387379492,0.275092936803,0.178503787879,0.200279459711,0.724907063197,0.761612620508,13.0,12.5,-109.0,-101.0,183.0,180.5,-107.0,-103.0,-1700.0,-1600.0,1125.0,1075.0
25,25,5.83333333333,15.5,22.9,5.63333333333,37.8,81.8333333333,15.6333333333,21.4666666667,13.0,32.0333333333,17.3333333333,97.0666666667,7.6,13.5333333333,45.0333333333,0,39.9333333333,4.16666666667,12.8333333333,19.2666666667,4.66666666667,34.5333333333,81.1666666667,13.9,19.4,87.1333333333,11.3,28.6333333333,7.03333333333,17.8333333333,13.7666666667,Chicago,2/12/2012_Boston_Chicago,2012-02-12,2.0,Boston,0.0,2,1,Charlotte,,3.0,0.0,30,False,False,False,0,0.497556008147,0.129120075309,0.45112936345,0.13305069457,0.31224979984,0.260769230769,0.191038696538,0.171252566735,0.739230769231,0.68775020016,6.03703703704,15.2962962963,22.5185185185,5.37037037037,34.5185185185,75.2222222222,15.1111111111,19.7777777778,8.77777777778,30.2962962963,20.2222222222,90.1851851852,6.40740740741,14.8148148148,39.0740740741,1,41.0740740741,4.44444444444,15.8148148148,16.7407407407,5.25925925926,32.5185185185,78.1111111111,17.2592592593,22.2222222222,86.7407407407,11.2962962963,29.7777777778,8.18518518519,19.037037037,13.8148148148,176.925925926,1,Boston,2012-02-12,2.0,Boston,Boston,0.0,3,3,20,0,Toronto,,3.0,0.0,27,4,False,False,False,1,0.499015263417,0.150039760537,0.444760550024,0.135833940277,0.227665706052,0.271593944791,0.200886262925,0.220957799905,0.728406055209,0.772334293948,3.5,1.0,-103.0,-107.0,176.0,171.5,-113.0,102.0,-145.0,-108.0,131.0,-102.0
26,26,5.93548387097,15.6129032258,23.2258064516,5.70967741935,38.0,81.9032258065,15.9032258065,21.6129032258,12.8709677419,32.0,17.4838709677,97.8387096774,7.54838709677,13.5161290323,44.8709677419,1,40.1290322581,4.32258064516,12.9677419355,19.3225806452,4.64516129032,34.7741935484,81.4193548387,14.1612903226,19.6774193548,88.0322580645,11.4838709677,28.6451612903,7.03225806452,17.935483871,13.7741935484,Chicago,2/14/2012_Chicago_Sacramento,2012-02-14,3.0,Chicago,0.0,2,0,Boston,,3.0,-1.0,31,False,False,False,0,0.500196927924,0.128812100344,0.453645007924,0.132633409952,0.310023310023,0.26409495549,0.194170933438,0.173930269414,0.73590504451,0.689976689977,6.25,20.1785714286,16.6785714286,4.07142857143,34.0357142857,83.75,18.5357142857,25.1071428571,14.1785714286,29.6428571429,19.5357142857,92.8571428571,8.17857142857,14.7142857143,43.8214285714,0,45.3571428571,6.03571428571,18.25,23.25,6.53571428571,39.4285714286,84.0,16.3571428571,21.8214285714,101.25,12.7142857143,32.6428571429,8.5,21.25,14.6785714286,194.107142857,0,Sacramento,2012-02-14,2.0,Chicago,Chicago,0.0,2,0,22,2,Sacramento,,0.0,2.0,28,-6,False,False,False,1,0.443710021322,0.13436301495,0.50531462585,0.135561243337,0.302822273074,0.300168634064,0.22132196162,0.194727891156,0.699831365936,0.697177726926,-12.5,-11.0,-104.0,-106.0,187.5,186.0,-102.0,-108.0,925.0,760.0,-1350.0,-1000.0
27,27,6.0625,15.78125,23.34375,5.6875,37.75,81.71875,16.0,21.8125,12.96875,32.125,17.5625,97.5625,7.4375,13.59375,45.09375,1,40.03125,4.28125,13.03125,19.1875,4.71875,34.65625,81.3125,14.1875,19.625,87.78125,11.3125,28.71875,7.0625,18.03125,13.5625,Chicago,2/16/2012_Chicago_Boston,2012-02-16,1.0,Chicago,0.0,2,0,Chicago,0.0,2.0,0.0,32,False,False,False,0,0.499043977055,0.1295753503,0.452536510377,0.131025987827,0.311094452774,0.260431654676,0.195793499044,0.174481168332,0.739568345324,0.688905547226,5.75862068966,14.9655172414,22.0344827586,5.48275862069,34.3793103448,75.3793103448,15.2413793103,20.1379310345,8.65517241379,30.1379310345,20.2413793103,89.7586206897,6.48275862069,14.275862069,38.7931034483,0,41.5517241379,4.62068965517,15.8620689655,17.0689655172,5.13793103448,32.5172413793,77.8965517241,17.5517241379,22.6551724138,87.2068965517,11.4482758621,30.1034482759,7.93103448276,19.2068965517,13.7931034483,176.965517241,0,Boston,2012-02-16,2.0,Chicago,Chicago,0.0,2,3,20,-1,Boston,,3.0,-1.0,29,-9,True,True,False,1,0.49428179323,0.144909274194,0.447100486941,0.135681528317,0.223309608541,0.275290215589,0.2021957914,0.225320938468,0.724709784411,0.776690391459,-8.0,-7.5,-102.0,-108.0,178.0,179.0,-101.0,-109.0,305.0,292.0,-350.0,-333.0
28,28,6.02941176471,15.8235294118,23.0,5.64705882353,37.5,81.9705882353,15.9411764706,21.8823529412,13.1764705882,32.2352941176,17.6764705882,96.9705882353,7.38235294118,13.5,45.4117647059,1,40.3529411765,4.58823529412,13.6470588235,19.1764705882,4.91176470588,34.5,81.2058823529,14.2058823529,19.8235294118,87.7941176471,11.3529411765,29.0,7.11764705882,17.9705882353,13.4411764706,Chicago,2/20/2012_Chicago_Atlanta,2012-02-20,2.0,Chicago,0.0,2,0,Chicago,0.0,2.0,0.0,34,False,False,False,0,0.494259059921,0.128450533951,0.453096704093,0.130030501684,0.312412831241,0.260458839406,0.194474345174,0.174936617168,0.739541160594,0.687587168759,7.1875,18.84375,22.0625,5.1875,35.8125,80.65625,15.21875,21.0,10.0,31.34375,17.5,94.03125,8.0625,12.96875,41.34375,0,42.84375,6.15625,17.3125,21.1875,4.90625,35.65625,81.5625,14.375,19.0,91.84375,10.84375,32.0,7.0625,18.71875,14.34375,185.875,0,Atlanta,2012-02-20,2.0,Chicago,Chicago,0.0,2,3,20,-1,Portland,,0.0,2.0,32,-11,False,False,False,1,0.488570321581,0.126075438682,0.474904214559,0.137568484529,0.238095238095,0.257037037037,0.188686555599,0.176245210728,0.742962962963,0.761904761905,-10.0,-10.5,102.0,-113.0,182.5,180.5,100.0,-110.0,516.0,577.0,-625.0,-711.0
29,29,6.02857142857,15.7428571429,23.2571428571,5.68571428571,37.6571428571,81.8857142857,16.0,21.9428571429,13.2,32.3142857143,17.5428571429,97.3428571429,7.28571428571,13.6857142857,45.5142857143,1,40.0285714286,4.51428571429,13.6285714286,19.2,4.94285714286,34.5714285714,81.4,14.2285714286,19.8,87.8857142857,11.3714285714,28.6571428571,7.22857142857,18.0285714286,13.2857142857,Chicago,2/22/2012_Chicago_Milwaukee,2012-02-22,2.0,Chicago,0.0,2,0,Chicago,0.0,2.0,0.0,35,False,False,False,0,0.496685275645,0.13005984382,0.452439452439,0.128491373117,0.315358361775,0.260300850229,0.195394277739,0.174798174798,0.739699149771,0.684641638225,6.66666666667,20.2121212121,21.0606060606,5.21212121212,35.8787878788,84.6666666667,16.1212121212,20.3636363636,12.7575757576,28.6363636364,19.9696969697,94.5454545455,8.0303030303,13.9090909091,41.3939393939,0,45.1212121212,6.78787878788,19.3333333333,21.8181818182,4.90909090909,36.0,80.5151515152,18.0,23.9090909091,96.7878787879,12.2727272727,32.8484848485,7.60606060606,19.3333333333,15.6363636364,191.333333333,0,Milwaukee,2012-02-22,2.0,Chicago,Chicago,0.0,2,2,20,0,Milwaukee,,2.0,0.0,33,-19,False,False,False,1,0.463135289907,0.129343868706,0.489273616861,0.146584246171,0.279734219269,0.3,0.19040801718,0.223560406473,0.7,0.720265780731,-12.0,-10.5,-105.0,-105.0,188.5,189.0,-105.0,-105.0,671.0,569.0,-850.0,-700.0
30,30,5.94444444444,15.8055555556,23.3055555556,5.80555555556,37.75,82.1111111111,15.9444444444,21.8888888889,13.25,32.3888888889,17.5,97.3888888889,7.38888888889,13.6666666667,45.6388888889,1,40.2222222222,4.5,13.5,19.2777777778,5.0,34.6111111111,81.6111111111,14.3611111111,19.8611111111,88.0833333333,11.4166666667,28.8055555556,7.25,18.0277777778,13.3055555556,Chicago,2/28/2012_Chicago_New Orleans,2012-02-28,6.0,Chicago,0.0,2,0,Chicago,0.0,2.0,0.0,36,False,False,False,0,0.495940460081,0.129653834802,0.451667801225,0.128363168614,0.315059445178,0.260621433101,0.194181326116,0.175970047651,0.739378566899,0.684940554822,3.97058823529,12.3529411765,19.8823529412,4.91176470588,34.5,78.8529411765,15.3823529412,20.6470588235,11.8529411765,30.0294117647,20.7647058824,88.3529411765,7.55882352941,14.6176470588,41.8823529412,0,40.8235294118,5.97058823529,19.3823529412,19.8235294118,5.94117647059,34.6176470588,77.5882352941,18.1764705882,23.7647058824,93.3823529412,10.8529411765,29.9705882353,7.88235294118,18.3529411765,13.6176470588,181.735294118,0,New Orleans,2012-02-28,6.0,Chicago,Chicago,0.0,2,2,20,0,Cleveland,,3.0,-1.0,34,-4,False,False,False,1,0.462700484894,0.142534300005,0.484647460197,0.133949752931,0.283403656821,0.265467625899,0.195076464006,0.23426838514,0.734532374101,0.716596343179,-12.5,-13.5,-110.0,100.0,179.0,180.0,-105.0,-105.0,1075.0,1100.0,-1600.0,-1625.0
31,31,5.97297297297,15.7837837838,23.1081081081,5.72972972973,37.7297297297,82.2702702703,15.9189189189,21.8648648649,13.2432432432,32.5135135135,17.4324324324,97.3513513514,7.37837837838,13.7027027027,45.7567567568,1,40.2702702703,4.59459459459,13.6756756757,19.2972972973,5.0,34.6756756757,81.7297297297,14.1621621622,19.6486486486,88.1081081081,11.3783783784,28.8918918919,7.27027027027,18.0540540541,13.3243243243,Chicago,2/29/2012_San Antonio_Chicago,2012-02-29,6.0,San Antonio,0.0,2,0,Chicago,,2.0,0.0,37,True,True,False,0,0.494908015769,0.129768413293,0.452380952381,0.128489814641,0.314304041052,0.259236453202,0.193495400788,0.17328042328,0.740763546798,0.685695958948,7.97142857143,20.2285714286,22.2285714286,4.4,37.7428571429,82.3428571429,15.5428571429,21.3142857143,9.94285714286,31.3714285714,17.2285714286,99.0,7.02857142857,12.8571428571,41.3142857143,0,42.2,6.14285714286,17.4571428571,19.4285714286,5.08571428571,37.7142857143,82.8571428571,14.0285714286,18.7142857143,95.6,10.1714285714,32.0285714286,7.51428571429,19.2,13.2857142857,194.6,1,San Antonio,2012-02-29,1.0,San Antonio,San Antonio,0.0,2,2,20,0,Denver,,1.0,1.0,35,-7,False,False,False,1,0.506766134629,0.122942757852,0.49224137931,0.12728566736,0.236895847515,0.244841815681,0.188757807078,0.169310344828,0.755158184319,0.763104152485,-2.0,-2.0,-107.0,-103.0,190.5,192.5,-101.0,-109.0,118.0,111.0,-130.0,-123.0
32,32,6.07894736842,15.8947368421,23.3157894737,5.63157894737,37.9736842105,82.4473684211,15.7105263158,21.6052631579,13.2368421053,32.3947368421,17.3947368421,97.7368421053,7.42105263158,13.6052631579,45.6315789474,1,40.0789473684,4.71052631579,13.8947368421,19.3684210526,5.0,34.6842105263,81.6842105263,14.1052631579,19.5526315789,88.1842105263,11.3421052632,28.7368421053,7.26315789474,17.9473684211,13.3421052632,Chicago,3/2/2012_Cleveland_Chicago,2012-03-02,2.0,Cleveland,0.0,2,1,San Antonio,,2.0,1.0,38,False,False,False,0,0.497446536866,0.128887825211,0.453447164948,0.128748171624,0.315360501567,0.259326113117,0.190552186403,0.172680412371,0.740673886883,0.684639498433,6.94117647059,19.3529411765,20.3823529412,4.67647058824,34.4705882353,81.1176470588,17.7352941176,25.4705882353,13.1176470588,30.1470588235,21.0882352941,93.6176470588,7.5,14.9117647059,43.2647058824,0,41.5588235294,6.44117647059,18.0,22.7058823529,5.94117647059,37.0882352941,81.7647058824,17.4705882353,23.1176470588,98.0882352941,11.0882352941,30.4705882353,7.5,21.4411764706,13.7058823529,191.705882353,1,Cleveland,2012-03-02,2.0,Cleveland,Cleveland,0.0,3,3,20,0,New York,,3.0,0.0,34,-21,False,False,False,1,0.467730239304,0.139054974712,0.492985611511,0.12973851842,0.300944669366,0.268901569187,0.218636693256,0.213669064748,0.731098430813,0.699055330634,8.5,10.0,-101.0,-109.0,190.0,187.0,100.0,-110.0,-400.0,-600.0,346.0,498.0
33,33,6.10256410256,15.8974358974,23.2564102564,5.64102564103,38.0,82.4358974359,15.5897435897,21.4615384615,13.1282051282,32.4871794872,17.4102564103,97.6923076923,7.28205128205,13.5897435897,45.6153846154,1,40.3333333333,4.61538461538,13.8205128205,19.5384615385,4.97435897436,34.7692307692,82.0769230769,14.1025641026,19.4871794872,88.2564102564,11.5128205128,28.8205128205,7.20512820513,17.8717948718,13.1282051282,Chicago,3/4/2012_Philadelphia_Chicago,2012-03-04,2.0,Philadelphia,0.0,2,1,Cleveland,,3.0,0.0,39,False,False,False,0,0.497978227061,0.128850941341,0.451733833177,0.126500963582,0.312958435208,0.261655011655,0.189113530327,0.171821305842,0.738344988345,0.687041564792,5.60526315789,15.3157894737,21.9210526316,4.78947368421,37.5526315789,83.8157894737,13.4473684211,18.2105263158,10.1578947368,32.9210526316,17.7631578947,94.1578947368,8.55263157895,10.1052631579,43.0789473684,0,44.6842105263,5.05263157895,15.9736842105,18.4736842105,4.5,33.6052631579,80.6578947368,14.9736842105,20.5,87.2368421053,11.2368421053,33.4473684211,5.36842105263,16.3947368421,13.6578947368,181.394736842,1,Philadelphia,2012-03-04,2.0,Philadelphia,Philadelphia,0.0,3,3,21,0,Philadelphia,0.0,3.0,0.0,38,-5,False,False,False,1,0.48147566719,0.099135660956,0.447960848287,0.13217003331,0.232951116476,0.254469606675,0.16043956044,0.185644371941,0.745530393325,0.767048883524,4.0,3.5,-105.0,-105.0,180.0,180.5,-104.0,-106.0,-177.0,-161.0,159.0,145.0
34,34,6.175,15.875,23.175,5.7,37.875,82.325,15.625,21.6,13.25,32.725,17.45,97.55,7.225,13.65,45.975,1,40.125,4.575,13.875,19.5,5.025,34.575,82.0,14.125,19.55,87.85,11.4,28.725,7.3,17.875,12.975,Chicago,3/5/2012_Chicago_Indiana,2012-03-05,2.0,Chicago,0.0,2,0,Philadelphia,,3.0,-1.0,40,True,True,False,0,0.497570604312,0.129409645522,0.449542682927,0.125269123454,0.315664085765,0.25835694051,0.189796538111,0.172256097561,0.74164305949,0.684335914235,5.66666666667,15.5555555556,18.0555555556,5.63888888889,34.6666666667,81.0833333333,20.2222222222,26.0277777778,12.6111111111,31.5277777778,21.4444444444,95.2222222222,8.36111111111,13.8055555556,44.1388888889,0,42.8888888889,6.33333333333,18.5277777778,19.25,6.11111111111,34.0833333333,80.0555555556,17.3888888889,24.0277777778,91.8888888889,12.0277777778,30.8611111111,6.63888888889,21.5,15.3333333333,187.111111111,0,Indiana,2012-03-05,1.0,Chicago,Indianapolis,,2,3,19,-1,New Orleans,,2.0,0.0,36,-20,False,False,False,1,0.462487153135,0.129823314909,0.465301873699,0.144707177686,0.290095846645,0.276147959184,0.249400479616,0.217210270645,0.723852040816,0.709904153355,-7.0,-7.0,-106.0,-104.0,186.0,190.0,-103.0,-107.0,264.0,260.0,-300.0,-295.0
35,35,6.14634146341,15.8780487805,23.243902439,5.73170731707,38.0,82.3414634146,15.6097560976,21.487804878,13.3170731707,32.5853658537,17.3902439024,97.756097561,7.19512195122,13.7317073171,45.9024390244,1,40.0,4.58536585366,13.9024390244,19.7317073171,5.0,34.756097561,82.1463414634,14.1463414634,19.5365853659,88.243902439,11.512195122,28.487804878,7.41463414634,17.8048780488,12.9024390244,Chicago,3/7/2012_Milwaukee_Chicago,2012-03-07,2.0,Milwaukee,0.0,2,0,Chicago,,2.0,0.0,41,False,False,False,0,0.498815165877,0.130124068561,0.451009501188,0.124486991227,0.318553092182,0.261061946903,0.189573459716,0.172209026128,0.738938053097,0.681446907818,6.5641025641,19.8974358974,21.6153846154,4.92307692308,36.1538461538,85.1538461538,16.7179487179,21.0769230769,12.9487179487,28.5641025641,19.7948717949,95.5897435897,8.15384615385,13.8717948718,41.5128205128,0,45.5641025641,7.02564102564,19.5641025641,22.0256410256,5.0,36.641025641,81.4102564103,17.7948717949,23.5897435897,98.1025641026,12.7435897436,32.8205128205,7.48717948718,19.2820512821,15.7948717949,193.692307692,1,Milwaukee,2012-03-07,2.0,Milwaukee,Milwaukee,0.0,2,2,19,0,Milwaukee,0.0,2.0,0.0,39,-2,False,False,False,1,0.463113520024,0.128087355103,0.493228346457,0.146813480147,0.282913165266,0.308504034761,0.196326407709,0.218582677165,0.691495965239,0.717086834734,8.0,7.5,101.0,-111.0,195.0,194.5,-108.0,-102.0,-330.0,-300.0,289.0,264.0
36,36,6.11904761905,16.0238095238,23.2857142857,5.69047619048,37.9285714286,82.4285714286,15.6904761905,21.5952380952,13.3571428571,32.4047619048,17.5238095238,97.6666666667,7.2619047619,13.5714285714,45.7619047619,0,40.2142857143,4.7380952381,14.1904761905,19.6666666667,4.97619047619,34.6904761905,82.0,14.380952381,19.8095238095,88.5,11.6428571429,28.5714285714,7.30952380952,17.7857142857,12.9523809524,Chicago,3/8/2012_Chicago_Orlando,2012-03-08,2.0,Chicago,0.0,2,0,Milwaukee,,2.0,0.0,42,True,True,False,0,0.497255921433,0.12863681089,0.451945412311,0.124940285893,0.318568994889,0.264324324324,0.190352397458,0.17537746806,0.735675675676,0.681431005111,10.3414634146,26.6341463415,20.4390243902,4.21951219512,33.9512195122,77.5609756098,15.6829268293,24.1951219512,11.3170731707,32.1219512195,18.1707317073,93.9268292683,6.36585365854,14.512195122,43.4390243902,1,41.9024390244,6.14634146341,18.1219512195,20.1219512195,4.39024390244,35.243902439,81.1463414634,15.0487804878,19.756097561,91.6829268293,10.6341463415,31.2682926829,7.68292682927,20.8536585366,12.756097561,185.609756098,0,Orlando,2012-03-08,1.0,Chicago,Chicago,0.0,2,3,19,-1,Charlotte,,3.0,-1.0,41,5,False,False,False,1,0.504402515723,0.141280499967,0.472197174632,0.124334347661,0.265750286369,0.248716486024,0.202201257862,0.185452359483,0.751283513976,0.734249713631,-6.5,-6.0,-105.0,-105.0,183.5,182.0,-105.0,-105.0,218.0,222.0,-245.0,-250.0
37,37,6.13953488372,16.0697674419,23.4651162791,5.6976744186,38.0465116279,82.3023255814,15.7441860465,21.6511627907,13.3720930233,32.3023255814,17.5348837209,97.976744186,7.27906976744,13.5813953488,45.6744186047,1,40.0,4.62790697674,13.9302325581,19.7674418605,4.95348837209,34.8139534884,82.0697674419,14.4418604651,19.8604651163,88.6976744186,11.6976744186,28.3023255814,7.3488372093,17.6976744186,12.9534883721,Chicago,3/10/2012_Chicago_Utah,2012-03-10,1.0,Chicago,0.0,2,0,Chicago,0.0,2.0,0.0,43,False,False,False,0,0.499576151455,0.128843234848,0.452394446019,0.124838628703,0.320870535714,0.265856236786,0.191296976547,0.175970529895,0.734143763214,0.679129464286,3.6,12.05,20.95,5.675,37.225,82.325,18.65,24.775,12.75,29.7,21.95,96.7,8.275,13.55,42.45,0,40.8,6.05,17.8,20.025,5.875,36.25,79.15,19.425,25.725,97.975,11.2,29.6,7.55,20.65,14.1,194.675,0,Utah,2012-03-10,2.0,Chicago,Salt Lake City,,2,1,19,1,Philadelphia,,3.0,-1.0,40,-14,True,True,True,1,0.474035833586,0.126901176294,0.496209728364,0.134839197085,0.30106257379,0.273838630807,0.226541147889,0.24542008844,0.726161369193,0.69893742621,-10.5,-10.0,-101.0,-109.0,190.0,191.0,-105.0,-105.0,590.0,597.0,-730.0,-740.0
38,38,6.11363636364,16.0227272727,23.5,5.68181818182,38.0909090909,82.5454545455,15.8181818182,21.7954545455,13.5681818182,32.3409090909,17.6136363636,98.1136363636,7.27272727273,13.5454545455,45.9090909091,1,39.9545454545,4.59090909091,13.8636363636,19.7954545455,5.13636363636,34.8636363636,82.0227272727,14.6136363636,20.1136363636,88.9318181818,11.6363636364,28.3181818182,7.34090909091,17.7727272727,12.9545454545,Chicago,3/12/2012_Chicago_New York,2012-03-12,1.0,Chicago,0.0,2,0,Chicago,0.0,2.0,0.0,44,False,False,False,0,0.498485682819,0.128173145575,0.453034081463,0.124770160231,0.323928377645,0.264599483204,0.191629955947,0.178165696869,0.735400516796,0.676071622355,6.85714285714,21.9761904762,19.7857142857,4.30952380952,35.4285714286,81.3095238095,18.9761904762,25.2380952381,11.1904761905,30.5952380952,21.2142857143,96.6904761905,9.52380952381,15.880952381,41.7857142857,0,42.5952380952,6.7380952381,18.0714285714,19.8095238095,5.07142857143,35.9523809524,80.4523809524,17.8333333333,24.0238095238,96.4761904762,10.8095238095,31.7857142857,8.66666666667,22.4761904762,16.3095238095,193.166666667,0,New York,2012-03-12,2.0,Chicago,Chicago,0.0,2,3,22,-1,New York,,3.0,-1.0,42,-5,True,True,False,1,0.477891654466,0.146644974057,0.488754069251,0.151953433482,0.260387811634,0.261069580219,0.233382137628,0.221663213969,0.738930419781,0.739612188366,-8.5,-8.0,-103.0,-107.0,197.5,198.5,100.0,-110.0,380.0,346.0,-444.0,-400.0
39,39,6.2,16.0888888889,23.4222222222,5.73333333333,38.0444444444,82.4222222222,16.0,21.8888888889,13.5777777778,32.4222222222,17.6888888889,98.2888888889,7.17777777778,13.5777777778,46.0,1,39.8222222222,4.62222222222,13.8222222222,19.7333333333,5.13333333333,34.9333333333,82.0888888889,14.7333333333,20.1777777778,89.2222222222,11.6222222222,28.2,7.35555555556,17.8888888889,12.8888888889,Chicago,3/14/2012_Chicago_Miami,2012-03-14,1.0,Chicago,0.0,2,0,Chicago,0.0,2.0,0.0,45,False,False,False,0,0.499191156646,0.128539571675,0.453708716838,0.124103459491,0.325,0.263874873865,0.194122404961,0.179480238224,0.736125126135,0.675,5.95238095238,15.0952380952,20.9285714286,5.2619047619,38.4523809524,79.6428571429,19.6428571429,25.1666666667,10.3095238095,31.9523809524,20.4523809524,102.5,8.88095238095,14.7142857143,42.2619047619,0,40.0476190476,7.95238095238,21.6904761905,19.7142857143,4.35714285714,34.5714285714,81.0952380952,17.1666666667,23.619047619,94.2619047619,11.7619047619,28.2857142857,8.33333333333,20.9761904762,16.0,196.761904762,0,Miami,2012-03-14,2.0,Chicago,Chicago,0.0,2,3,19,-1,Orlando,,3.0,-1.0,42,-4,True,True,False,1,0.520179372197,0.139563874185,0.47533763946,0.148854353104,0.267119062307,0.269063180828,0.2466367713,0.211685261304,0.730936819172,0.732880937693,-3.0,3.0,-109.0,-101.0,191.5,189.0,-103.0,-107.0,129.0,-154.0,-143.0,139.0
40,40,6.23913043478,16.3260869565,23.3695652174,5.69565217391,38.0,82.4782608696,15.847826087,21.652173913,13.6739130435,32.3043478261,17.6304347826,98.0869565217,7.08695652174,13.4782608696,45.9782608696,0,39.7173913043,4.76086956522,13.9782608696,19.6739130435,5.08695652174,35.0217391304,82.0217391304,14.652173913,20.0,89.4565217391,11.5652173913,28.152173913,7.26086956522,17.8260869565,12.7826086957,Chicago,3/16/2012_Chicago_Portland,2012-03-16,2.0,Chicago,0.0,2,0,Chicago,0.0,2.0,0.0,46,False,False,False,0,0.498550342646,0.127776037459,0.456003180493,0.123379075916,0.326923076923,0.263627353816,0.192145492884,0.178637688842,0.736372646184,0.673076923077,6.61363636364,19.8863636364,20.8636363636,5.25,36.5227272727,81.8181818182,17.5,22.1590909091,10.9545454545,30.5227272727,20.0681818182,97.1590909091,8.34090909091,14.0,41.4772727273,1,42.25,6.25,18.4090909091,20.1818181818,4.56818181818,35.9545454545,80.1136363636,16.8863636364,23.0,95.0454545455,11.0454545455,31.2045454545,7.61363636364,20.6136363636,14.7045454545,192.204545455,0,Portland,2012-03-16,2.0,Chicago,Chicago,0.0,2,0,21,2,New York,,3.0,-1.0,44,11,False,False,False,1,0.486805555556,0.132615715823,0.48780141844,0.140125788343,0.259838274933,0.265718972116,0.213888888889,0.210780141844,0.734281027884,0.740161725067,-9.0,-8.5,-105.0,-105.0,192.0,194.0,-107.0,-103.0,423.0,365.0,-500.0,-425.0
41,41,6.23404255319,16.4255319149,23.1914893617,5.74468085106,37.8510638298,82.3617021277,15.9574468085,21.8510638298,13.7446808511,32.3829787234,17.4893617021,97.8936170213,7.06382978723,13.4893617021,46.1276595745,1,39.7021276596,4.72340425532,13.9574468085,19.5957446809,5.0,34.9787234043,81.9574468085,14.5744680851,19.8936170213,89.2553191489,11.5106382979,28.1914893617,7.27659574468,17.8723404255,12.7659574468,Chicago,3/17/2012_Chicago_Philadelphia,2012-03-17,1.0,Chicago,0.0,2,0,Chicago,0.0,2.0,0.0,47,True,False,False,0,0.497416688194,0.127903035781,0.455607476636,0.123370481556,0.327752409944,0.262239457101,0.19374838543,0.177829698858,0.737760542899,0.672247590056,5.51111111111,15.0666666667,21.7555555556,4.84444444444,37.6,83.8444444444,13.4222222222,18.2666666667,10.4444444444,32.9111111111,17.7555555556,94.1333333333,8.55555555556,10.3555555556,43.3555555556,0,44.3555555556,5.02222222222,15.8444444444,18.5777777778,4.82222222222,33.6888888889,80.5333333333,15.4222222222,20.9333333333,87.8222222222,11.2,33.1555555556,5.55555555556,16.1111111111,13.4888888889,181.955555556,0,Philadelphia,2012-03-17,1.0,Chicago,Chicago,0.0,2,3,22,-1,Philadelphia,,3.0,-1.0,45,-9,True,True,False,1,0.481314603764,0.101289374614,0.449503311258,0.130664646065,0.239551478084,0.253904282116,0.160084813146,0.191501103753,0.746095717884,0.760448521916,-6.0,-4.0,-113.0,102.0,185.0,186.5,-105.0,-105.0,184.0,184.0,-205.0,-205.0
42,42,6.25,16.4583333333,23.1041666667,5.6875,37.7916666667,82.2916666667,15.7916666667,21.625,13.6875,32.4791666667,17.4791666667,97.625,7.125,13.5,46.1666666667,1,39.6666666667,4.70833333333,14.0833333333,19.375,5.0,34.75,81.6666666667,14.4166666667,19.8541666667,88.625,11.4791666667,28.1875,7.3125,17.75,12.875,Chicago,3/19/2012_Orlando_Chicago,2012-03-19,1.0,Orlando,0.0,2,1,Chicago,,2.0,1.0,48,False,False,False,0,0.497215189873,0.128197011902,0.454336734694,0.12466413304,0.326865671642,0.261137440758,0.191898734177,0.176530612245,0.738862559242,0.673134328358,10.1489361702,26.5531914894,20.2127659574,4.23404255319,34.0,77.2127659574,15.4468085106,24.0,10.9787234043,32.0,17.8085106383,93.5957446809,6.6170212766,14.6808510638,42.9787234043,0,41.7872340426,6.14893617021,18.085106383,20.0425531915,4.27659574468,35.4042553191,81.2553191489,14.9361702128,19.4468085106,91.8936170213,10.5319148936,31.2553191489,7.89361702128,20.7446808511,12.6808510638,185.489361702,1,Orlando,2012-03-19,2.0,Orlando,Orlando,0.0,3,3,22,0,Miami,,3.0,0.0,47,-26,True,True,False,1,0.506062276109,0.143292657601,0.473553286201,0.123724352108,0.259949622166,0.247623811906,0.200055111601,0.183817753339,0.752376188094,0.740050377834,1.0,-2.0,100.0,-110.0,184.0,183.5,102.0,-113.0,-102.0,118.0,-108.0,-130.0
43,43,6.26530612245,16.4489795918,23.0408163265,5.67346938776,37.7551020408,82.2857142857,15.7755102041,21.6530612245,13.6530612245,32.5714285714,17.3469387755,97.5510204082,7.08163265306,13.5102040816,46.2244897959,1,39.693877551,4.63265306122,13.9591836735,19.4489795918,4.95918367347,34.7551020408,81.7346938776,14.3469387755,19.6734693878,88.4897959184,11.4285714286,28.2653061224,7.36734693878,17.7551020408,12.7959183673,Chicago,3/21/2012_Toronto_Chicago,2012-03-21,1.0,Toronto,0.0,2,1,Orlando,,3.0,0.0,49,False,False,False,0,0.496899801587,0.12827369188,0.453558052434,0.124007151672,0.32570593963,0.25974025974,0.191716269841,0.175530586767,0.74025974026,0.67429406037,5.3829787234,16.2553191489,21.1063829787,4.97872340426,34.3617021277,78.2553191489,16.5744680851,21.5531914894,10.170212766,30.9361702128,24.2340425532,90.6808510638,7.02127659574,14.7446808511,41.1063829787,0,41.170212766,6.25531914894,18.4255319149,19.5531914894,4.76595744681,33.8510638298,77.5319148936,21.0212765957,28.0638297872,94.9787234043,10.1914893617,30.9787234043,7.27659574468,18.7234042553,13.1063829787,185.659574468,1,Toronto,2012-03-21,2.0,Toronto,Toronto,0.0,3,3,20,0,New York,,3.0,0.0,47,-12,True,True,False,1,0.473491027732,0.143873839459,0.476948408342,0.12726326141,0.247156153051,0.247801345059,0.211799891245,0.271130625686,0.752198654941,0.752843846949,6.5,7.0,-103.0,-107.0,186.0,183.5,100.0,-110.0,-295.0,-315.0,260.0,277.0
44,44,6.2,16.58,23.04,5.72,37.82,82.7,15.8,21.74,13.8,32.38,17.38,97.64,7.18,13.42,46.18,1,40.06,4.6,13.96,19.44,5.08,34.84,81.84,14.46,19.78,88.74,11.64,28.42,7.3,17.8,12.9,Chicago,3/24/2012_Chicago_Toronto,2012-03-24,1.0,Chicago,0.0,2,0,Toronto,,3.0,-1.0,50,False,False,False,0,0.494800483676,0.12698040225,0.453812316716,0.124706118914,0.326859308385,0.264425261245,0.191051995163,0.176686217009,0.735574738755,0.673140691615,5.24489795918,16.1428571429,21.0816326531,5.12244897959,34.5306122449,78.5306122449,16.693877551,21.7142857143,10.4489795918,31.1020408163,24.0816326531,91.0,6.95918367347,14.8571428571,41.5510204082,0,41.1836734694,6.16326530612,18.7142857143,19.6734693878,4.85714285714,33.9591836735,78.2040816327,20.7142857143,27.8163265306,94.7959183673,10.4081632653,30.7755102041,7.38775510204,18.7551020408,13.2040816327,185.795918367,0,Toronto,2012-03-24,3.0,Chicago,Chicago,0.0,2,3,21,-1,Toronto,,3.0,-1.0,49,-1,True,True,False,1,0.473102910603,0.144325318784,0.473643006263,0.127394304077,0.253465346535,0.250737463127,0.212577962578,0.26487473904,0.749262536873,0.746534653465,-13.0,-12.5,-116.0,105.0,184.0,182.0,-104.0,-106.0,975.0,752.0,-1400.0,-975.0
45,45,6.33333333333,16.6470588235,23.0588235294,5.82352941176,37.7647058824,82.5294117647,15.6470588235,21.5294117647,13.6274509804,32.2745098039,17.3333333333,97.5098039216,7.09803921569,13.4509803922,45.9019607843,0,40.1568627451,4.66666666667,14.0,19.5294117647,5.11764705882,35.0196078431,81.9607843137,14.4117647059,19.7058823529,89.1176470588,11.6862745098,28.4705882353,7.35294117647,17.6862745098,12.8235294118,Chicago,3/26/2012_Chicago_Denver,2012-03-26,1.0,Chicago,0.0,2,0,Chicago,0.0,2.0,0.0,51,False,False,False,0,0.495961035876,0.127553866407,0.455741626794,0.12395284485,0.323707498836,0.265834076717,0.189593727726,0.175837320574,0.734165923283,0.676292501164,6.6,20.26,23.58,5.16,38.38,81.64,20.36,27.66,11.14,32.36,19.52,103.72,8.44,15.34,43.5,1,40.44,8.56,22.34,23.48,6.5,38.92,84.4,15.86,20.7,102.26,10.52,29.92,8.18,22.6,15.0,205.98,0,Denver,2012-03-26,2.0,Chicago,Chicago,0.0,2,1,18,1,Minneapolis,,2.0,0.0,50,17,True,True,False,1,0.510534051935,0.140540025506,0.511848341232,0.138238655214,0.271310277642,0.245335820896,0.24938755512,0.187914691943,0.754664179104,0.728689722358,-8.0,-8.0,-107.0,-103.0,199.0,198.5,-105.0,-105.0,318.0,305.0,-365.0,-350.0
46,46,6.38461538462,16.6346153846,23.1153846154,5.80769230769,37.7692307692,82.5,15.5961538462,21.5,13.6153846154,32.2692307692,17.25,97.5192307692,7.05769230769,13.3269230769,45.8846153846,1,40.0769230769,4.67307692308,14.0576923077,19.5384615385,5.13461538462,34.9615384615,81.9230769231,14.2884615385,19.5,88.8846153846,11.6153846154,28.4615384615,7.25,17.6538461538,12.7884615385,Chicago,3/28/2012_Atlanta_Chicago,2012-03-28,1.0,Atlanta,0.0,2,1,Chicago,,2.0,1.0,52,False,False,False,0,0.496503496503,0.126577191995,0.455281690141,0.123809381958,0.323583180987,0.264680105171,0.189044289044,0.17441314554,0.735319894829,0.676416819013,7.36538461538,19.7307692308,21.8461538462,4.71153846154,36.1153846154,81.4807692308,14.9807692308,20.5769230769,10.25,31.1730769231,18.0192307692,94.5769230769,7.96153846154,13.3076923077,41.4230769231,0,42.8653846154,5.96153846154,17.6923076923,20.9230769231,5.07692307692,35.9230769231,81.6153846154,15.2692307692,20.0769230769,93.0769230769,10.9038461538,31.9615384615,7.46153846154,19.1153846154,14.2692307692,187.653846154,1,Atlanta,2012-03-28,2.0,Atlanta,Atlanta,0.0,3,3,16,0,Milwaukee,,2.0,1.0,52,-21,True,True,False,1,0.488435213595,0.128152894552,0.476672950047,0.136262799888,0.242824601367,0.259140767824,0.183856502242,0.187087653157,0.740859232176,0.757175398633,4.0,4.0,-104.0,-106.0,183.0,181.5,-106.0,-104.0,-172.0,-166.0,155.0,150.0
47,47,6.30188679245,16.5471698113,23.0943396226,5.88679245283,37.6603773585,82.358490566,15.6226415094,21.4905660377,13.7358490566,32.2830188679,17.1509433962,97.2452830189,7.03773584906,13.358490566,46.0188679245,1,40.0188679245,4.64150943396,14.0,19.4528301887,5.11320754717,34.8867924528,81.9622641509,14.1320754717,19.2641509434,88.5471698113,11.6981132075,28.320754717,7.2641509434,17.679245283,12.7547169811,Chicago,3/30/2012_Chicago_Detroit,2012-03-30,2.0,Chicago,0.0,2,0,Atlanta,,3.0,-1.0,53,False,False,False,0,0.495532646048,0.127014653329,0.453959484346,0.12360035398,0.326603858232,0.26598026598,0.189690721649,0.172421731123,0.73401973402,0.673396141768,4.49019607843,13.0980392157,18.6274509804,4.05882352941,34.1960784314,79.1568627451,16.6274509804,21.8823529412,11.8823529412,27.9019607843,19.3137254902,89.5098039216,7.07843137255,14.568627451,39.7843137255,0,40.2745098039,5.82352941176,16.2941176471,22.3725490196,5.60784313725,36.0588235294,77.0,17.2549019608,22.4901960784,95.1960784314,10.431372549,29.8431372549,8.60784313725,19.568627451,14.0392156863,184.705882353,0,Detroit,2012-03-30,2.0,Chicago,Chicago,0.0,2,3,20,-1,Cleveland,,3.0,-1.0,51,-12,False,False,False,1,0.460366608868,0.140958899951,0.506111535523,0.139091785037,0.28477443609,0.272122762148,0.210056973,0.224089635854,0.727877237852,0.71522556391,-12.0,-11.0,-102.0,-108.0,182.0,181.5,-104.0,-106.0,795.0,704.0,-1050.0,-900.0
48,48,6.33333333333,16.6851851852,22.9814814815,5.81481481481,37.5185185185,82.5185185185,15.5185185185,21.3703703704,13.8148148148,32.2407407407,17.0925925926,96.8888888889,7.09259259259,13.3333333333,46.0555555556,0,40.0185185185,4.62962962963,13.9074074074,19.462962963,5.18518518519,34.9074074074,81.8148148148,14.1666666667,19.2222222222,88.6111111111,11.537037037,28.4814814815,7.24074074074,17.6296296296,12.7592592593,Chicago,4/1/2012_Oklahoma City_Chicago,2012-04-01,3.0,Oklahoma City,0.0,2,0,Chicago,,2.0,0.0,54,False,False,False,0,0.493043087971,0.126676706969,0.454956994115,0.123838007664,0.326619964974,0.263536379019,0.188061041293,0.17315527388,0.736463620981,0.673380035026,7.15384615385,19.9230769231,18.5769230769,7.92307692308,37.6923076923,78.8461538462,20.9423076923,26.2115384615,10.7115384615,32.6730769231,20.2115384615,103.480769231,7.57692307692,15.9423076923,43.3846153846,1,40.9423076923,6.42307692308,18.7307692308,20.0961538462,4.65384615385,36.3846153846,84.9807692308,17.5192307692,22.5192307692,96.7115384615,12.5576923077,28.3846153846,8.26923076923,19.9807692308,13.7692307692,200.192307692,1,Oklahoma City,2012-04-01,2.0,Oklahoma City,Oklahoma City,0.0,2,2,21,0,Los Angeles,,0.0,2.0,52,14,False,False,False,1,0.523414634146,0.149944290903,0.465942520932,0.126720280908,0.273979340876,0.277636054422,0.265609756098,0.206155238742,0.722363945578,0.726020659124,-5.0,-6.0,-101.0,-109.0,194.0,191.5,-106.0,-104.0,193.0,218.0,-215.0,-245.0
49,49,6.30909090909,16.6909090909,23.0181818182,5.83636363636,37.5636363636,82.5272727273,15.3818181818,21.2909090909,13.8909090909,32.1818181818,17.0909090909,96.8181818182,7.05454545455,13.4363636364,46.0727272727,0,39.9818181818,4.61818181818,13.8909090909,19.5272727273,5.18181818182,35.0363636364,81.9454545455,14.1090909091,19.1272727273,88.8,11.5636363636,28.4181818182,7.30909090909,17.6363636364,12.6727272727,Chicago,4/2/2012_Chicago_Houston,2012-04-02,1.0,Chicago,0.0,2,0,Oklahoma City,,2.0,0.0,55,True,True,False,0,0.493390614673,0.127562469361,0.455735522521,0.122995369586,0.328319724968,0.26433915212,0.186384666226,0.172176614156,0.73566084788,0.671680275032,6.92592592593,19.3518518519,21.0,4.90740740741,37.8148148148,83.4074074074,15.5925925926,19.8518518519,11.5555555556,30.5925925926,20.2592592593,98.1481481481,7.33333333333,14.0740740741,42.1481481481,1,41.2407407407,5.48148148148,17.2407407407,20.037037037,5.22222222222,37.7407407407,82.962962963,16.5,21.6111111111,97.462962963,11.1481481481,30.0925925926,7.51851851852,18.4074074074,13.9814814815,195.611111111,0,Houston,2012-04-02,1.0,Chicago,Chicago,0.0,2,2,21,0,Houston,,2.0,0.0,54,6,True,True,False,1,0.494893428064,0.132503905378,0.487946428571,0.131339067023,0.277456647399,0.267080745342,0.186944937833,0.198883928571,0.732919254658,0.722543352601,-8.0,-7.5,-104.0,-106.0,187.0,185.0,100.0,-110.0,354.0,310.0,-410.0,-355.0
50,50,6.28571428571,16.6785714286,23.0,5.875,37.4821428571,82.4821428571,15.5,21.375,13.8928571429,32.1428571429,17.1071428571,96.75,7.07142857143,13.4107142857,46.0357142857,1,39.9107142857,4.625,13.875,19.5714285714,5.125,35.0,81.8571428571,14.125,19.1071428571,88.75,11.4821428571,28.4285714286,7.32142857143,17.75,12.6785714286,Chicago,4/5/2012_Chicago_Boston,2012-04-05,1.0,Chicago,0.0,2,0,Chicago,0.0,2.0,0.0,56,False,False,False,0,0.492530850834,0.127359802465,0.45582460733,0.12316125451,0.328270042194,0.263200982399,0.187919463087,0.172556719023,0.736799017601,0.671729957806,5.37037037037,14.8888888889,23.5185185185,5.5,35.2407407407,77.0925925926,15.5185185185,19.9444444444,7.7962962963,30.7407407407,20.1666666667,91.3703703704,7.33333333333,14.0555555556,38.537037037,0,43.5555555556,4.98148148148,16.5555555556,18.6666666667,4.72222222222,33.6666666667,80.1666666667,17.5185185185,23.0740740741,89.8333333333,12.0555555556,31.5,7.88888888889,18.5925925926,14.4444444444,181.203703704,0,Boston,2012-04-05,3.0,Chicago,Chicago,0.0,2,3,21,-1,Boston,,3.0,-1.0,54,-7,True,True,False,1,0.491952918568,0.14066287612,0.451027951028,0.137876420304,0.198397737983,0.281696235396,0.201297141485,0.218526218526,0.718303764604,0.801602262017,-8.0,-8.0,-105.0,-105.0,176.5,178.0,104.0,-115.0,281.0,222.0,-320.0,-250.0
51,51,6.29824561404,16.7719298246,22.8421052632,5.94736842105,37.4385964912,82.5964912281,15.6140350877,21.5438596491,13.9649122807,32.298245614,17.1754385965,96.7894736842,7.0,13.5087719298,46.2631578947,0,40.0350877193,4.68421052632,14.2280701754,19.5263157895,5.14035087719,35.0701754386,82.2105263158,14.1228070175,19.1228070175,88.9473684211,11.5614035088,28.4736842105,7.38596491228,17.8947368421,12.6140350877,Chicago,4/8/2012_New York_Chicago,2012-04-08,3.0,New York,0.0,2,1,Chicago,,2.0,1.0,57,False,False,False,0,0.491397621071,0.127942681679,0.4550789586,0.122183325969,0.329061595701,0.2636,0.189039932031,0.171788305591,0.7364,0.670938404299,7.28571428571,22.8392857143,19.6964285714,4.33928571429,35.4821428571,81.1428571429,18.9821428571,25.625,11.8035714286,30.8392857143,21.3392857143,97.2321428571,9.53571428571,15.6428571429,42.6428571429,1,41.875,6.42857142857,18.3392857143,18.8392857143,4.91071428571,35.0535714286,79.6964285714,17.9642857143,24.2142857143,94.5,10.8214285714,31.0535714286,8.32142857143,22.3571428571,16.3392857143,191.732142857,1,New York,2012-04-08,3.0,New York,New York,0.0,3,3,19,0,Orlando,,3.0,0.0,56,1,False,False,False,1,0.482174295775,0.144759890273,0.480170289043,0.153147302599,0.275416666667,0.259751393056,0.233934859155,0.225408917768,0.740248606944,0.724583333333,2.5,3.0,-103.0,-107.0,186.0,185.0,-105.0,-105.0,-138.0,-145.0,125.0,131.0
52,52,6.34482758621,16.8275862069,22.9137931034,6.01724137931,37.4655172414,82.724137931,15.5344827586,21.4482758621,14.0344827586,32.3103448276,17.1896551724,96.8103448276,7.0,13.4827586207,46.3448275862,1,39.9137931034,4.72413793103,14.3448275862,19.4655172414,5.13793103448,35.0,82.0517241379,14.1724137931,19.1551724138,88.8965517241,11.4482758621,28.4655172414,7.39655172414,17.9137931034,12.6724137931,Chicago,4/10/2012_Chicago_New York,2012-04-10,2.0,Chicago,0.0,2,0,New York,,3.0,-1.0,58,False,False,False,0,0.491246352647,0.127624294966,0.455347762135,0.122851354875,0.330223123732,0.261623325453,0.187786577741,0.172725362471,0.738376674547,0.669776876268,7.28070175439,22.8070175439,19.6315789474,4.35087719298,35.4035087719,81.0,18.9473684211,25.5438596491,11.6842105263,30.7894736842,21.298245614,97.0350877193,9.50877192982,15.649122807,42.4736842105,0,42.0350877193,6.47368421053,18.3684210526,18.9824561404,5.0,35.1228070175,79.8771929825,17.8421052632,24.0701754386,94.5614035088,10.9473684211,31.0877192982,8.29824561404,22.2807017544,16.2631578947,191.596491228,0,New York,2012-04-10,2.0,Chicago,Chicago,0.0,2,3,22,-1,New York,,3.0,-1.0,57,-12,False,False,False,1,0.482022958631,0.145049141088,0.48023281353,0.152374878363,0.273174733388,0.262295081967,0.233918128655,0.223369207116,0.737704918033,0.726825266612,-9.0,-7.0,-114.0,103.0,185.5,187.0,105.0,-116.0,334.0,264.0,-385.0,-300.0
53,53,6.42372881356,16.9152542373,22.9661016949,5.96610169492,37.4576271186,82.7796610169,15.4576271186,21.406779661,14.0508474576,32.2711864407,17.1525423729,96.7966101695,7.06779661017,13.5084745763,46.3220338983,1,39.9322033898,4.71186440678,14.2881355932,19.4237288136,5.18644067797,35.0169491525,82.0508474576,14.1016949153,19.1016949153,88.8474576271,11.4237288136,28.5084745763,7.4406779661,17.8813559322,12.7457627119,Chicago,4/12/2012_Chicago_Miami,2012-04-12,2.0,Chicago,0.0,2,0,Chicago,0.0,2.0,0.0,59,False,False,False,0,0.491298116298,0.127791531446,0.455484404049,0.123503829933,0.330147351653,0.261442979054,0.186732186732,0.171865317083,0.738557020946,0.669852648347,5.66666666667,15.350877193,20.3859649123,5.47368421053,37.5438596491,79.3684210526,19.3333333333,25.0175438596,10.3684210526,31.1929824561,19.7192982456,100.087719298,9.14035087719,14.4736842105,41.5614035088,0,40.2456140351,7.61403508772,20.4035087719,19.8070175439,4.36842105263,34.7368421053,80.4035087719,16.5964912281,22.701754386,93.6842105263,11.5263157895,28.7192982456,8.33333333333,20.8421052632,15.9649122807,193.771929825,0,Miami,2012-04-12,2.0,Chicago,Chicago,0.0,2,3,22,-1,Miami,,3.0,-1.0,57,-10,False,False,False,1,0.508731211317,0.138042045097,0.479380318569,0.150106559162,0.26526032316,0.269815195072,0.24358974359,0.206415012001,0.730184804928,0.73473967684,-2.0,-1.5,-105.0,-105.0,186.5,185.0,-104.0,-106.0,114.0,111.0,-126.0,-123.0
54,54,6.4,16.9166666667,22.9166666667,5.96666666667,37.4833333333,82.9166666667,15.4833333333,21.4333333333,14.1,32.2833333333,17.2333333333,96.85,7.06666666667,13.6,46.3833333333,1,39.95,4.73333333333,14.3,19.3666666667,5.2,34.9833333333,82.0833333333,14.2333333333,19.25,88.9333333333,11.4,28.55,7.5,17.95,12.8333333333,Chicago,4/15/2012_Detroit_Chicago,2012-04-15,2.0,Detroit,0.0,2,1,Chicago,,2.0,1.0,60,False,False,False,0,0.490653266332,0.12836566596,0.455025380711,0.124129481558,0.330597889801,0.260969095765,0.186733668342,0.173401015228,0.739030904235,0.669402110199,4.51666666667,13.1833333333,18.5333333333,4.06666666667,34.6,78.9833333333,16.8833333333,22.3333333333,11.8166666667,28.1166666667,19.7333333333,90.6,7.0,14.7166666667,39.9333333333,0,40.15,6.06666666667,16.7833333333,22.6333333333,5.4,36.2833333333,77.5833333333,17.4833333333,22.8333333333,96.1166666667,10.4833333333,29.6666666667,8.61666666667,19.6833333333,13.8166666667,186.716666667,1,Detroit,2012-04-15,3.0,Detroit,Detroit,0.0,3,3,22,0,Detroit,0.0,3.0,0.0,60,-6,False,False,False,1,0.466659632834,0.142153390431,0.506766917293,0.136196359335,0.284853354761,0.271588946459,0.213758176831,0.225349087003,0.728411053541,0.715146645239,8.0,9.5,100.0,-110.0,184.0,184.5,-107.0,-103.0,-380.0,-520.0,330.0,439.0
55,55,6.3606557377,16.868852459,22.9016393443,6.0,37.393442623,82.9344262295,15.4918032787,21.4426229508,14.1475409836,32.2950819672,17.3114754098,96.6393442623,7.06557377049,13.6557377049,46.4426229508,0,40.0163934426,4.72131147541,14.3606557377,19.3442622951,5.29508196721,34.9672131148,82.1967213115,14.2459016393,19.2459016393,88.9016393443,11.4262295082,28.5901639344,7.52459016393,18.0,12.8196721311,Chicago,4/16/2012_Chicago_Washington,2012-04-16,2.0,Chicago,0.0,2,0,Detroit,,3.0,-1.0,61,True,True,False,0,0.489227119984,0.128797437039,0.454128440367,0.123880010645,0.331031837361,0.261342332208,0.186795809449,0.173314718787,0.738657667792,0.668968162639,5.22950819672,16.393442623,18.7049180328,6.49180327869,36.0819672131,82.7868852459,15.5901639344,21.3114754098,11.8032786885,29.7213114754,21.262295082,92.9836065574,7.75409836066,14.5573770492,41.5245901639,1,43.7868852459,6.55737704918,18.393442623,21.9836065574,4.5737704918,37.1475409836,81.393442623,18.7049180328,24.7540983607,99.5573770492,12.3606557377,31.4262295082,7.95081967213,18.7540983607,14.2295081967,192.540983607,0,Washington,2012-04-16,1.0,Chicago,Washington DC,,2,3,19,-1,Washington DC,,3.0,-1.0,61,3,False,False,False,1,0.467425742574,0.136405529954,0.49667673716,0.133591898298,0.273037542662,0.293728087261,0.188316831683,0.229808660624,0.706271912739,0.726962457338,-13.5,-11.5,101.0,-111.0,189.5,187.0,-105.0,-105.0,975.0,760.0,-1400.0,-1000.0
56,56,6.40322580645,16.9032258065,23.0,6.0,37.435483871,82.935483871,15.4193548387,21.4032258065,14.1774193548,32.435483871,17.3064516129,96.6935483871,7.0,13.5806451613,46.6129032258,1,39.9838709677,4.66129032258,14.2580645161,19.2741935484,5.3064516129,34.8064516129,82.2258064516,14.2903225806,19.3064516129,88.564516129,11.4677419355,28.5161290323,7.48387096774,17.9516129032,12.7096774194,Chicago,4/18/2012_Charlotte_Chicago,2012-04-18,2.0,Charlotte,0.0,2,1,Chicago,,2.0,1.0,62,False,False,False,0,0.489984441851,0.1281996626,0.451647704982,0.122881540947,0.33207404609,0.261204996326,0.185919875535,0.173793644566,0.738795003674,0.66792595391,3.98360655738,13.4426229508,20.1639344262,5.4262295082,33.3442622951,80.4590163934,16.5245901639,22.1147540984,10.262295082,28.7049180328,19.0655737705,87.1967213115,6.16393442623,13.262295082,38.9672131148,0,45.3278688525,6.18032786885,17.1967213115,23.2459016393,5.80327868852,38.737704918,81.9508196721,17.1803278689,22.7868852459,100.836065574,11.9180327869,33.4098360656,7.3606557377,20.1147540984,13.0,188.032786885,1,Charlotte,2012-04-18,2.0,Charlotte,Charlotte,0.0,3,3,20,0,Charlotte,0.0,3.0,0.0,61,-32,False,False,False,1,0.439180929095,0.128197814457,0.510402080416,0.123836591917,0.234984984985,0.293381759483,0.205378973105,0.209641928386,0.706618240517,0.765015015015,11.5,13.0,-103.0,-107.0,181.0,179.0,-104.0,-106.0,-1100.0,-1600.0,816.0,1075.0
57,57,6.33333333333,16.8888888889,22.8888888889,5.93650793651,37.2380952381,82.7301587302,15.4920634921,21.5079365079,14.0634920635,32.4444444444,17.3333333333,96.3015873016,6.95238095238,13.5714285714,46.5079365079,0,40.0634920635,4.65079365079,14.2380952381,19.1904761905,5.28571428571,34.7619047619,82.126984127,14.3015873016,19.3333333333,88.4761904762,11.4285714286,28.6349206349,7.46031746032,17.9682539683,12.6984126984,Chicago,4/19/2012_Miami_Chicago,2012-04-19,1.0,Miami,0.0,2,1,Charlotte,,3.0,0.0,63,True,True,False,0,0.488392171911,0.128316724697,0.451584847313,0.122889374985,0.32936802974,0.260492040521,0.187260168841,0.174139930421,0.739507959479,0.67063197026,5.58064516129,15.3870967742,20.3225806452,5.35483870968,37.5483870968,79.1935483871,19.0483870968,24.6290322581,10.3225806452,31.2419354839,19.5806451613,99.7258064516,8.98387096774,14.3548387097,41.564516129,1,39.8064516129,7.35483870968,20.2903225806,19.6129032258,4.22580645161,34.5161290323,79.9032258065,16.3387096774,22.5,92.7258064516,11.2741935484,28.5322580645,8.14516129032,20.6451612903,15.8064516129,192.451612903,1,Miami,2012-04-19,1.0,Miami,Miami,0.0,3,3,19,0,Miami,0.0,3.0,0.0,62,11,True,False,False,1,0.509368635438,0.137518000952,0.477997577715,0.149668590977,0.265670402657,0.265174506829,0.240529531568,0.204481227291,0.734825493171,0.734329597343,-5.0,-6.5,-104.0,-106.0,183.0,183.5,103.0,-114.0,197.0,244.0,-220.0,-275.0
58,58,6.375,16.9375,22.984375,5.875,37.25,82.75,15.375,21.359375,13.96875,32.53125,17.265625,96.25,6.96875,13.515625,46.5,1,40.109375,4.640625,14.25,19.078125,5.25,34.703125,82.078125,14.34375,19.328125,88.390625,11.40625,28.703125,7.453125,17.921875,12.6875,Chicago,4/21/2012_Chicago_Dallas,2012-04-21,1.0,Chicago,0.0,2,0,Miami,,3.0,-1.0,64,False,False,False,0,0.488670694864,0.127911653713,0.451075575861,0.122857557858,0.327352618089,0.25960170697,0.18580060423,0.174757281553,0.74039829303,0.672647381911,7.56923076923,22.2923076923,20.9230769231,5.13846153846,36.3846153846,82.0615384615,15.5538461538,20.1692307692,10.0923076923,32.7076923077,18.6923076923,95.8923076923,8.55384615385,13.4923076923,42.8,0,43.9538461538,7.13846153846,20.6307692308,20.3538461538,4.03076923077,35.4153846154,81.6153846154,16.6923076923,22.2615384615,94.6615384615,11.0769230769,32.8769230769,8.50769230769,18.4,13.9846153846,190.553846154,0,Dallas,2012-04-21,2.0,Chicago,Chicago,0.0,2,2,21,0,Dallas,,2.0,0.0,65,-10,True,True,False,1,0.489501312336,0.129201631152,0.477662582469,0.132687558023,0.234872896527,0.252986647927,0.189538807649,0.20452403393,0.747013352073,0.765127103473,-8.0,-8.0,100.0,-110.0,181.5,182.5,102.0,-112.0,235.0,310.0,-265.0,-356.0
59,59,6.36923076923,16.9384615385,23.0461538462,5.86153846154,37.2615384615,82.7230769231,15.2923076923,21.1846153846,13.8923076923,32.5692307692,17.2615384615,96.1846153846,6.93846153846,13.5076923077,46.4615384615,1,40.0153846154,4.66153846154,14.2461538462,19.0307692308,5.23076923077,34.7076923077,82.0461538462,14.2923076923,19.2769230769,88.3692307692,11.3384615385,28.6769230769,7.47692307692,17.8,12.6307692308,Chicago,4/25/2012_Indiana_Chicago,2012-04-25,2.0,Indianapolis,0.0,2,1,Chicago,,2.0,1.0,65,False,False,False,0,0.488934350009,0.127971921969,0.451434464654,0.122440092345,0.326346223347,0.258234057463,0.184861446903,0.174198387399,0.741765942537,0.673653776653,5.93939393939,16.1212121212,18.6060606061,5.40909090909,35.6666666667,81.4393939394,20.4393939394,26.1212121212,12.5151515152,31.3636363636,21.6666666667,97.7121212121,7.92424242424,13.2272727273,43.8787878788,0,42.303030303,6.69696969697,19.0757575758,19.5757575758,6.0303030303,34.9242424242,80.3636363636,17.8636363636,24.5,94.4090909091,12.0303030303,30.2727272727,6.56060606061,21.6363636364,14.3636363636,192.121212121,1,Indiana,2012-04-25,4.0,Indianapolis,Indianapolis,0.0,3,3,20,0,Indianapolis,0.0,3.0,0.0,66,-5,False,False,False,1,0.474418604651,0.124597520038,0.476244343891,0.136138827138,0.292492917847,0.277234636872,0.250976744186,0.222285067873,0.722765363128,0.707507082153,2.5,2.5,-110.0,100.0,189.0,188.0,109.0,-120.0,-137.0,-141.0,124.0,128.0
60,60,6.34848484848,16.9242424242,23.1363636364,5.87878787879,37.3787878788,82.7575757576,15.2424242424,21.1212121212,13.8636363636,32.803030303,17.2575757576,96.3484848485,6.90909090909,13.4393939394,46.6666666667,1,39.9848484848,4.62121212121,14.2272727273,18.8636363636,5.19696969697,34.6060606061,82.1212121212,14.3333333333,19.3787878788,88.1666666667,11.3636363636,28.6212121212,7.42424242424,17.6666666667,12.5454545455,Chicago,4/26/2012_Chicago_Cleveland,2012-04-26,1.0,Chicago,0.0,2,0,Indianapolis,,3.0,-1.0,66,True,True,False,0,0.490021969974,0.127399330112,0.449538745387,0.12157233554,0.326319543509,0.257289879931,0.184181618455,0.174538745387,0.742710120069,0.673680456491,6.66666666667,19.2878787879,19.8181818182,3.9696969697,34.2575757576,81.2121212121,17.8484848485,24.9242424242,12.7424242424,29.5303030303,19.9545454545,93.0303030303,7.06060606061,14.6212121212,42.2727272727,0,42.803030303,6.78787878788,18.7272727273,23.1363636364,6.19696969697,38.4242424242,82.2878787879,16.5909090909,22.1818181818,100.227272727,11.3939393939,31.4090909091,7.93939393939,20.9242424242,13.3636363636,193.257575758,0,Cleveland,2012-04-26,1.0,Chicago,Chicago,0.0,2,3,19,-1,Cleveland,,3.0,-1.0,66,-32,True,True,False,1,0.462873134328,0.136902735217,0.508193702817,0.126775868314,0.28860672615,0.278415401703,0.219776119403,0.201620327748,0.721584598297,0.71139327385,-13.0,-14.5,-105.0,-105.0,186.5,183.0,-109.0,-101.0,1900.0,1750.0,-4000.0,-3700.0
61,61,6.34328358209,16.8805970149,23.2089552239,5.88059701493,37.4179104478,82.6865671642,15.2686567164,21.1641791045,13.8059701493,32.8656716418,17.3432835821,96.447761194,6.89552238806,13.5074626866,46.671641791,1,39.9552238806,4.5671641791,14.1492537313,18.8507462687,5.19402985075,34.5820895522,82.1343283582,14.4776119403,19.552238806,88.2089552239,11.3731343284,28.5820895522,7.46268656716,17.7164179104,12.5223880597,Chicago,4/28/2012_Chicago_Philadelphia,2012-04-28,2.0,Chicago,0.0,2,0,Chicago,0.0,2.0,0.0,67,False,False,False,0,0.490884476534,0.128025214601,0.448846083954,0.121270814061,0.325704225352,0.257085020243,0.184657039711,0.17626749046,0.742914979757,0.674295774648,5.22388059701,14.5074626866,21.9552238806,5.14925373134,37.3731343284,83.5671641791,13.6268656716,18.3432835821,10.6865671642,32.3880597015,17.5820895522,93.5970149254,8.0,10.7164179104,43.0746268657,0,43.7910447761,5.41791044776,16.1791044776,19.7164179104,4.80597014925,34.3731343284,80.2985074627,15.4328358209,20.5373134328,89.5970149254,10.6865671642,33.1044776119,5.92537313433,16.3134328358,13.2835820896,183.194029851,0,Philadelphia,2012-04-28,2.0,Chicago,Chicago,0.0,2,3,20,-1,Detroit,,3.0,-1.0,67,-12,False,False,False,1,0.478478299696,0.104698910431,0.461802973978,0.129446260894,0.244035446489,0.248094248094,0.163064833006,0.19219330855,0.751905751906,0.755964553511,-9.0,-8.5,-108.0,-102.0,175.5,175.0,101.0,-111.0,404.0,450.0,-475.0,-535.0
79,79,7.0,20.5714285714,18.0476190476,4.19047619048,34.8095238095,80.2857142857,19.9523809524,26.380952381,11.8571428571,31.5714285714,19.4285714286,96.5714285714,7.85714285714,15.1428571429,43.4285714286,1,42.1428571429,5.85714285714,17.2857142857,19.8571428571,5.80952380952,36.2857142857,82.1428571429,16.380952381,22.0,94.8095238095,11.2380952381,30.9047619048,8.38095238095,22.1428571429,14.1428571429,Minnesota,1/30/2012_Houston_Minnesota,2012-01-30,2.0,Minneapolis,,2,0,Minneapolis,,2.0,0.0,21,True,True,False,0,0.477164887307,0.141474178738,0.477391304348,0.133466350302,0.27728285078,0.262513904338,0.248517200474,0.199420289855,0.737486095662,0.72271714922,6.7619047619,20.6666666667,21.0,5.04761904762,38.4285714286,85.3333333333,15.0476190476,18.9523809524,12.4761904762,31.8095238095,20.4761904762,98.6666666667,7.42857142857,13.9523809524,44.2857142857,0,41.7142857143,5.04761904762,16.619047619,19.4761904762,5.28571428571,38.1904761905,84.9523809524,15.5238095238,20.4761904762,96.9523809524,11.619047619,30.0952380952,7.28571428571,17.1904761905,14.0476190476,195.619047619,1,Houston,2012-01-30,1.0,Houston,Houston,0.0,2,2,15,0,Houston,0.0,2.0,0.0,21,-12,False,False,False,1,0.489955357143,0.129639134205,0.479260089686,0.130059077683,0.293064876957,0.267543859649,0.176339285714,0.182735426009,0.732456140351,0.706935123043,-7.0,-6.5,-110.0,100.0,196.0,198.5,100.0,-110.0,256.0,222.0,-290.0,-250.0
80,80,6.81818181818,20.4090909091,17.9545454545,4.18181818182,34.7727272727,80.7727272727,20.3181818182,26.8636363636,11.9545454545,31.8181818182,19.6818181818,96.6818181818,7.72727272727,15.1818181818,43.7727272727,0,42.2727272727,5.90909090909,17.1818181818,19.8181818182,5.81818181818,36.3636363636,82.2272727273,16.8181818182,22.5454545455,95.4545454545,11.0909090909,31.1818181818,8.27272727273,22.3181818182,14.0454545455,Minnesota,2/1/2012_Minnesota_Indiana,2012-02-01,1.0,Minneapolis,0.0,2,0,Houston,,2.0,0.0,22,False,False,False,0,0.472706809229,0.140866455226,0.478164731896,0.132263808513,0.277133825079,0.258474576271,0.251547552054,0.2045328911,0.741525423729,0.722866174921,5.42857142857,14.2857142857,18.0,5.47619047619,34.4285714286,80.4761904762,20.1904761905,25.380952381,12.380952381,32.380952381,21.0952380952,94.4761904762,8.66666666667,14.8095238095,44.7619047619,1,42.9047619048,6.57142857143,19.3333333333,18.7142857143,5.57142857143,33.9047619048,81.1904761905,16.8095238095,23.7142857143,91.1904761905,12.2857142857,30.619047619,7.14285714286,21.3333333333,15.380952381,185.666666667,0,Indiana,2012-02-01,2.0,Minneapolis,Indianapolis,,2,3,22,-1,Indianapolis,,3.0,-1.0,21,10,True,True,False,1,0.461538461538,0.139117520756,0.458064516129,0.14373954217,0.287929125138,0.275053304904,0.250887573964,0.207038123167,0.724946695096,0.712070874862,-2.5,-3.0,100.0,-110.0,194.5,196.0,-105.0,-105.0,120.0,135.0,-133.0,-149.0
81,81,6.79166666667,20.2083333333,18.3333333333,4.04166666667,34.9166666667,80.875,20.6666666667,26.9166666667,12.2083333333,31.875,19.4166666667,97.2916666667,7.75,15.25,44.0833333333,1,42.0,5.91666666667,17.0416666667,20.375,5.95833333333,36.5416666667,82.75,16.6666666667,22.25,95.6666666667,11.2083333333,30.7916666667,8.29166666667,22.4166666667,14.0,Minnesota,2/4/2012_Minnesota_Houston,2012-02-04,1.0,Minneapolis,0.0,2,0,Newark,,3.0,-1.0,24,True,True,False,0,0.47372488408,0.141245118167,0.477341389728,0.131406044678,0.283914728682,0.260154738878,0.255538382277,0.201409869084,0.739845261122,0.716085271318,6.54166666667,20.0416666667,20.8333333333,5.20833333333,38.375,85.4583333333,14.75,18.4166666667,12.4166666667,31.75,20.375,98.0416666667,7.5,14.125,44.1666666667,0,41.7083333333,5.125,16.9166666667,19.375,5.04166666667,37.8333333333,84.375,15.7083333333,20.75,96.5,11.4583333333,30.25,7.54166666667,16.9166666667,14.0833333333,194.541666667,0,Houston,2012-02-04,1.0,Minneapolis,Minneapolis,0.0,2,2,22,0,Houston,,2.0,0.0,24,-9,True,True,False,1,0.487323256948,0.131167584969,0.478765432099,0.130900190541,0.291015625,0.26518804243,0.172598732326,0.186172839506,0.73481195757,0.708984375,-2.5,-1.5,102.0,-113.0,203.0,204.0,-105.0,-105.0,111.0,111.0,-123.0,-123.0
82,82,6.68,19.96,18.44,4.12,34.8,80.8,20.56,26.96,12.2,32.08,19.44,96.84,7.88,15.28,44.28,1,42.24,6.0,17.28,20.36,5.88,36.32,82.72,16.56,22.2,95.2,11.2,31.04,8.36,22.56,14.04,Minnesota,2/7/2012_Minnesota_Sacramento,2012-02-07,1.0,Minneapolis,0.0,2,0,Minneapolis,0.0,2.0,0.0,25,False,False,False,0,0.47202970297,0.141556978537,0.475338491296,0.131796335236,0.282146160962,0.258780036969,0.254455445545,0.200193423598,0.741219963031,0.717853839038,6.04,20.28,16.36,4.12,33.76,83.2,18.24,24.84,13.88,29.84,19.32,91.8,8.12,14.8,43.72,0,46.08,5.8,18.04,23.12,5.88,39.36,84.52,16.08,21.76,100.6,13.12,32.96,8.76,21.16,14.4,192.4,0,Sacramento,2012-02-07,3.0,Minneapolis,Minneapolis,0.0,2,0,22,2,New Orleans,,2.0,0.0,25,-2,True,True,False,1,0.442067307692,0.135867569513,0.5,0.13272574437,0.296327924851,0.305400372439,0.219230769231,0.190250828206,0.694599627561,0.703672075149,-6.5,-6.5,-102.0,-108.0,197.0,197.5,100.0,-110.0,218.0,231.0,-245.0,-260.0
83,83,6.57692307692,19.9230769231,18.3461538462,4.15384615385,34.6538461538,80.7307692308,20.3076923077,26.6538461538,12.1153846154,32.2692307692,19.2692307692,96.1923076923,7.96153846154,15.2692307692,44.3846153846,0,42.8846153846,5.92307692308,17.0384615385,20.2692307692,5.80769230769,36.2692307692,83.1538461538,16.3461538462,21.9230769231,94.8076923077,11.5769230769,31.3076923077,8.42307692308,22.4230769231,14.1153846154,Minnesota,2/8/2012_Memphis_Minnesota,2012-02-08,2.0,Minneapolis,,2,0,Minneapolis,,2.0,0.0,26,True,True,False,0,0.46998570748,0.141739142853,0.471785383904,0.132023886611,0.279007971656,0.264035087719,0.25154835636,0.196577243293,0.735964912281,0.720992028344,3.53846153846,11.1538461538,18.5769230769,4.88461538462,36.2307692308,82.9230769231,16.4615384615,22.0,12.3076923077,30.2692307692,19.3076923077,92.4615384615,10.3846153846,14.7307692308,42.5769230769,1,42.1538461538,6.61538461538,19.1153846154,19.0,5.84615384615,33.7692307692,77.3076923077,17.5,23.3846153846,91.6538461538,11.0769230769,31.0769230769,8.19230769231,19.3461538462,17.4615384615,184.115384615,1,Memphis,2012-02-08,1.0,Memphis,Memphis,0.0,2,2,20,0,Memphis,0.0,2.0,0.0,26,5,False,False,False,1,0.458256029685,0.137242535869,0.47960199005,0.166207825679,0.283687943262,0.267906976744,0.198515769944,0.226368159204,0.732093023256,0.716312056738,-8.0,-7.5,-105.0,-105.0,189.0,190.0,-113.0,102.0,297.0,269.0,-340.0,-305.0
84,84,6.55555555556,20.037037037,18.4074074074,4.03703703704,34.5555555556,80.6666666667,20.5555555556,26.8148148148,12.1481481481,32.3333333333,19.3333333333,96.2222222222,7.92592592593,15.7037037037,44.4814814815,0,42.7037037037,6.03703703704,17.1851851852,20.4444444444,5.88888888889,36.3703703704,83.4074074074,16.3703703704,21.962962963,95.1481481481,11.4444444444,31.2592592593,8.7037037037,22.6296296296,14.2592592593,Minnesota,2/10/2012_Minnesota_Dallas,2012-02-10,2.0,Minneapolis,0.0,2,0,Memphis,,2.0,0.0,27,False,False,False,0,0.469008264463,0.145177637165,0.472246891652,0.132853909011,0.279863481229,0.261421319797,0.254820936639,0.196269982238,0.738578680203,0.720136518771,6.96296296296,21.3703703704,21.5555555556,5.62962962963,35.8148148148,81.2222222222,16.0,21.6296296296,10.2222222222,32.5925925926,19.8518518519,94.5925925926,9.25925925926,14.037037037,42.8148148148,1,43.3703703704,6.7037037037,18.962962963,19.0740740741,4.37037037037,33.2222222222,79.0740740741,18.3333333333,24.2592592593,91.4814814815,11.2222222222,32.1481481481,9.03703703704,18.5925925926,15.3333333333,186.074074074,0,Dallas,2012-02-10,2.0,Minneapolis,Minneapolis,0.0,2,2,20,0,Denver,,1.0,1.0,27,7,False,False,False,1,0.483812129503,0.133971494825,0.462529274005,0.145918511208,0.241258741259,0.256128486898,0.196990424077,0.231850117096,0.743871513102,0.758741258741,2.0,2.0,-105.0,-105.0,189.5,192.5,100.0,-110.0,-125.0,-125.0,113.0,113.0
85,85,6.53571428571,20.0,18.3928571429,4.03571428571,34.6428571429,80.7857142857,20.4642857143,26.5357142857,12.0714285714,32.4642857143,19.3928571429,96.2857142857,7.96428571429,15.9285714286,44.5357142857,0,42.5357142857,6.07142857143,17.25,20.4285714286,5.71428571429,36.5,83.4285714286,16.25,21.9642857143,95.3214285714,11.2857142857,31.25,8.85714285714,22.6071428571,14.4285714286,Minnesota,2/11/2012_Minnesota_New York,2012-02-11,1.0,Minneapolis,0.0,2,0,Minneapolis,0.0,2.0,0.0,28,True,False,False,0,0.469274977896,0.14695609769,0.473886986301,0.134192519764,0.278647980214,0.257959183673,0.253315649867,0.19477739726,0.742040816327,0.721352019786,6.85714285714,22.6785714286,18.8571428571,4.14285714286,34.6071428571,80.3928571429,19.4642857143,25.3928571429,10.7142857143,30.75,22.0714285714,95.5357142857,9.5,15.6428571429,41.4642857143,1,42.4285714286,6.28571428571,16.9642857143,19.1428571429,5.03571428571,35.0357142857,78.5714285714,18.2857142857,24.6071428571,94.6428571429,10.0714285714,32.3571428571,8.0,22.7142857143,16.5357142857,190.178571429,0,New York,2012-02-11,1.0,Minneapolis,Minneapolis,0.0,2,3,19,-1,New York,,3.0,-1.0,28,2,True,True,False,1,0.473123056419,0.145910508222,0.485909090909,0.156094074494,0.248756218905,0.246719160105,0.242114615726,0.232727272727,0.753280839895,0.751243781095,-7.5,-6.5,-103.0,-107.0,194.0,197.5,-102.0,-108.0,210.0,230.0,-235.0,-259.0
86,86,6.51724137931,20.0344827586,18.2413793103,4.06896551724,34.5862068966,80.7586206897,20.3448275862,26.4827586207,12.1034482759,32.6206896552,19.3103448276,96.0344827586,7.79310344828,16.0,44.724137931,0,42.5517241379,6.27586206897,17.6896551724,20.4137931034,5.68965517241,36.4827586207,83.4827586207,16.3103448276,21.9655172414,95.5517241379,11.1724137931,31.3793103448,8.86206896552,22.4827586207,14.2413793103,Minnesota,2/13/2012_Orlando_Minnesota,2012-02-13,2.0,Minneapolis,,2,1,Minneapolis,,2.0,1.0,29,False,False,False,0,0.468616567037,0.147586452581,0.474597273854,0.132614922229,0.278350515464,0.255118110236,0.251921434671,0.195373812474,0.744881889764,0.721649484536,10.0,25.8275862069,19.8965517241,4.1724137931,33.4137931034,77.1724137931,16.4137931034,25.0344827586,10.8275862069,32.3103448276,18.4482758621,93.2413793103,6.48275862069,14.4137931034,43.1379310345,1,42.3448275862,6.1724137931,18.1724137931,20.0344827586,4.44827586207,35.0,80.4827586207,15.3103448276,19.9655172414,91.4827586207,10.1379310345,32.2068965517,7.37931034483,21.3793103448,12.724137931,184.724137931,1,Orlando,2012-02-13,2.0,Orlando,Orlando,0.0,3,3,22,0,Milwaukee,,2.0,1.0,29,13,False,False,False,1,0.497765862377,0.1404834243,0.47322193659,0.124756572541,0.251602564103,0.238830219334,0.212689901698,0.190231362468,0.761169780666,0.748397435897,-6.0,-4.5,100.0,-110.0,190.0,190.5,-105.0,-105.0,193.0,171.0,-215.0,-190.0
87,87,6.43333333333,19.9,18.5,4.13333333333,34.8666666667,80.9,20.0666666667,26.1333333333,12.0666666667,32.7,19.1666666667,96.2333333333,7.83333333333,15.9,44.7666666667,1,42.5,6.3,17.7,20.3,5.63333333333,36.5333333333,83.5333333333,16.0,21.7333333333,95.3666666667,11.2666666667,31.2333333333,8.83333333333,22.4,14.2666666667,Minnesota,2/15/2012_Minnesota_Charlotte,2012-02-15,2.0,Minneapolis,0.0,2,0,Orlando,,3.0,-1.0,30,False,False,False,0,0.470745776679,0.146816211957,0.475059856345,0.132882938824,0.278675904542,0.256254738438,0.248042851257,0.191540303272,0.743745261562,0.721324095458,4.20689655172,13.9655172414,19.1034482759,5.58620689655,33.5862068966,80.8275862069,15.1379310345,20.7586206897,10.3103448276,29.7586206897,19.2068965517,86.5172413793,5.79310344828,13.8965517241,40.0689655172,0,44.7931034483,6.41379310345,17.7586206897,23.3448275862,5.79310344828,38.8965517241,82.5172413793,16.6551724138,22.2068965517,100.862068966,11.275862069,33.5172413793,7.65517241379,19.2068965517,12.724137931,187.379310345,0,Charlotte,2012-02-15,2.0,Minneapolis,Minneapolis,0.0,2,3,21,-1,Charlotte,,3.0,-1.0,29,-12,False,False,False,1,0.441552901024,0.133803471586,0.510238194735,0.121167940736,0.235247836349,0.274789915966,0.18728668942,0.201838696197,0.725210084034,0.764752163651,-11.5,-10.5,-108.0,-102.0,190.5,195.0,-104.0,-106.0,604.0,509.0,-750.0,-615.0
88,88,6.38709677419,19.7419354839,18.6774193548,4.25806451613,35.1290322581,80.7741935484,20.064516129,26.0322580645,12.0967741935,32.6451612903,18.935483871,96.7096774194,7.8064516129,16.0,44.7419354839,1,41.9677419355,6.41935483871,17.7741935484,20.2903225806,5.58064516129,36.6451612903,83.5806451613,15.7419354839,21.3548387097,95.4516129032,11.1612903226,30.8064516129,8.83870967742,22.3548387097,14.1935483871,Minnesota,2/17/2012_Houston_Minnesota,2012-02-17,2.0,Minneapolis,,2,0,Minneapolis,,2.0,0.0,31,False,False,False,0,0.474440894569,0.147835521061,0.476842917792,0.132439168282,0.281954887218,0.254786450663,0.248402555911,0.188344268622,0.745213549337,0.718045112782,7.0,19.8709677419,20.935483871,4.93548387097,37.9677419355,84.5483870968,14.6451612903,18.5806451613,12.0,30.9677419355,20.2580645161,97.5806451613,7.96774193548,14.5161290323,42.9677419355,0,40.9032258065,5.54838709677,17.5483870968,19.5483870968,5.12903225806,37.6129032258,82.6774193548,15.8709677419,20.935483871,96.6451612903,10.8387096774,30.064516129,7.48387096774,17.4516129032,14.8709677419,194.225806452,1,Houston,2012-02-17,2.0,Houston,Houston,0.0,2,2,20,0,Houston,0.0,2.0,0.0,31,-13,False,False,False,1,0.490461655857,0.135361143531,0.488490050722,0.13929344082,0.28527607362,0.259259259259,0.173216329645,0.191962543894,0.740740740741,0.71472392638,-5.0,-5.0,-106.0,-104.0,199.0,198.0,-110.0,100.0,160.0,184.0,-178.0,-205.0
89,89,6.28125,19.625,18.5,4.3125,35.0625,80.90625,20.15625,26.03125,12.15625,32.6875,18.71875,96.5625,7.6875,15.8125,44.84375,1,42.15625,6.3125,17.5625,20.09375,5.59375,36.75,83.78125,15.5,21.0,95.3125,11.25,30.90625,8.84375,22.3125,14.0,Minnesota,2/19/2012_Minnesota_Philadelphia,2012-02-19,2.0,Minneapolis,0.0,2,0,Houston,,2.0,0.0,32,False,False,False,0,0.472190034762,0.146178557397,0.476314807907,0.130815141853,0.28229317852,0.256045519203,0.249130938586,0.185005594927,0.743954480797,0.71770682148,5.84375,15.625,22.09375,4.59375,37.625,83.0625,13.71875,18.84375,9.84375,33.1875,17.84375,94.8125,8.5,9.96875,43.03125,0,44.71875,5.03125,16.0625,18.625,4.46875,33.84375,80.875,14.59375,20.1875,87.3125,11.3125,33.40625,5.46875,16.8125,13.5,182.125,0,Philadelphia,2012-02-19,2.0,Minneapolis,Minneapolis,0.0,2,3,21,-1,Philadelphia,,3.0,-1.0,32,-1,False,False,False,1,0.488148984199,0.098386340645,0.44957496136,0.130741108394,0.227601156069,0.254213483146,0.165161775771,0.180448222566,0.745786516854,0.772398843931,-1.5,1.0,102.0,-113.0,190.0,191.5,-104.0,-106.0,-107.0,-103.0,-103.0,-107.0
90,90,6.27272727273,19.8484848485,18.6363636364,4.42424242424,35.0909090909,81.4545454545,20.2424242424,25.9696969697,12.2727272727,32.7272727273,18.8787878788,96.696969697,7.66666666667,15.7878787879,45.0,0,42.6060606061,6.27272727273,17.696969697,20.1818181818,5.75757575758,36.7575757576,84.0303030303,15.7575757576,21.4242424242,95.5454545455,11.4242424242,31.1818181818,8.78787878788,22.303030303,14.0606060606,Minnesota,2/20/2012_Denver_Minnesota,2012-02-20,1.0,Minneapolis,,2,-1,Minneapolis,,2.0,-1.0,33,True,True,False,0,0.469308035714,0.145283986972,0.47475658132,0.130774954342,0.282426778243,0.258750857927,0.248511904762,0.187522538767,0.741249142073,0.717573221757,6.69696969697,20.696969697,22.8484848485,5.33333333333,38.2424242424,81.0303030303,20.6363636364,28.1515151515,10.4242424242,32.6363636364,19.0909090909,103.818181818,8.9696969697,15.9090909091,43.0606060606,1,41.7272727273,8.06060606061,21.9696969697,22.5454545455,6.72727272727,38.8181818182,85.5757575758,15.1515151515,19.9393939394,100.848484848,11.1515151515,30.5757575758,8.51515151515,23.3333333333,15.8484848485,204.666666667,1,Denver,2012-02-20,1.0,Denver,Denver,0.0,1,1,20,0,Oklahoma City,,2.0,-1.0,33,2,True,True,False,1,0.513275991025,0.145519657627,0.500708215297,0.143818815791,0.254249815225,0.254671280277,0.254674644727,0.177053824363,0.745328719723,0.745750184775,-4.0,-3.5,-105.0,-105.0,209.5,209.5,-107.0,-103.0,147.0,140.0,-163.0,-155.0
91,91,6.41176470588,19.9117647059,18.6764705882,4.38235294118,34.9705882353,81.3235294118,20.4411764706,26.3235294118,12.4705882353,32.6176470588,18.8823529412,96.7941176471,7.58823529412,15.8235294118,45.0882352941,1,42.5588235294,6.11764705882,17.3823529412,20.3235294118,5.70588235294,36.8235294118,84.0588235294,15.8529411765,21.5,95.6176470588,11.5,31.0588235294,8.97058823529,22.5,13.9117647059,Minnesota,2/22/2012_Minnesota_Utah,2012-02-22,2.0,Minneapolis,0.0,2,0,Denver,,1.0,1.0,34,False,False,False,0,0.469439421338,0.145531270288,0.474457662701,0.129495378685,0.286486486486,0.260666666667,0.251356238698,0.188593421973,0.739333333333,0.713513513514,3.71875,12.53125,20.71875,5.90625,36.8125,81.5625,18.8125,25.1875,12.25,30.0625,22.4375,96.15625,8.125,13.5625,42.3125,0,41.40625,5.96875,17.9375,19.25,5.78125,36.09375,79.5625,19.5,25.71875,97.65625,11.375,30.03125,7.5,21.15625,14.15625,193.8125,0,Utah,2012-02-22,2.0,Minneapolis,Salt Lake City,,2,1,21,1,Salt Lake City,,1.0,1.0,32,-2,False,False,False,1,0.474137931034,0.127698138079,0.491162608013,0.13477650307,0.289726533629,0.274509803922,0.230651340996,0.245090337785,0.725490196078,0.710273466371,-4.0,-5.5,-105.0,-105.0,196.5,198.0,102.0,-113.0,144.0,188.0,-160.0,-210.0
92,92,6.32432432432,19.7567567568,18.8648648649,4.24324324324,35.0810810811,81.5675675676,20.2702702703,26.2702702703,12.4594594595,32.2162162162,18.8378378378,96.7567567568,7.59459459459,15.4324324324,44.6756756757,0,42.7297297297,5.89189189189,17.0540540541,20.7567567568,5.78378378378,37.1621621622,83.9459459459,15.8918918919,21.5135135135,96.1081081081,11.4324324324,31.2972972973,8.75675675676,22.5405405405,13.7837837838,Minnesota,3/1/2012_Phoenix_Minnesota,2012-03-01,8.0,Minneapolis,,2,-1,Los Angeles,,0.0,1.0,37,True,True,True,0,0.468853545394,0.142157204457,0.477784932389,0.128585259591,0.284743668931,0.261919504644,0.248508946322,0.189311010947,0.738080495356,0.715256331069,6.71428571429,19.7142857143,22.3714285714,5.28571428571,36.6,81.4,14.9714285714,19.3428571429,10.2,31.1428571429,19.0857142857,94.8857142857,7.22857142857,14.1714285714,41.3428571429,1,43.9142857143,6.31428571429,17.7142857143,21.6,4.4,37.0,82.3142857143,16.7142857143,21.9428571429,97.0285714286,11.9428571429,31.9714285714,8.4,19.1714285714,14.0,191.914285714,1,Phoenix,2012-03-01,1.0,Phoenix,Phoenix,0.0,1,1,19,0,Phoenix,0.0,1.0,0.0,35,9,False,False,False,1,0.490873990874,0.136156008433,0.487851440472,0.13211393074,0.241869918699,0.277188328912,0.183924183924,0.203054494967,0.722811671088,0.758130081301,-3.0,-4.5,-109.0,-101.0,200.5,203.0,-104.0,-106.0,160.0,160.0,-178.0,-178.0
93,93,6.47368421053,19.8421052632,18.8947368421,4.21052631579,35.2894736842,81.5263157895,20.3684210526,26.3157894737,12.3947368421,32.0789473684,18.8684210526,97.4210526316,7.5,15.3684210526,44.4736842105,1,42.6315789474,6.0,17.2894736842,20.6052631579,5.76315789474,37.2368421053,83.9210526316,16.0,21.6842105263,96.4736842105,11.4473684211,31.1842105263,8.76315789474,22.7105263158,13.7105263158,Minnesota,3/3/2012_Portland_Minnesota,2012-03-03,2.0,Minneapolis,,2,-2,Phoenix,,1.0,-1.0,38,False,False,False,0,0.472562943835,0.141678796701,0.479460645971,0.127929361384,0.284420289855,0.26299879081,0.249838605552,0.190655377861,0.73700120919,0.715579710145,6.78378378378,19.9459459459,21.8378378378,5.37837837838,37.1351351351,82.8918918919,17.4594594595,22.2702702703,10.972972973,30.6486486486,20.2702702703,98.5135135135,8.7027027027,13.9189189189,41.6216216216,0,42.3513513514,5.81081081081,18.0540540541,19.6486486486,5.08108108108,35.5675675676,80.0,17.5675675676,23.5135135135,94.5135135135,10.9189189189,31.4324324324,7.59459459459,20.8648648649,15.2972972973,193.027027027,1,Portland,2012-03-03,2.0,Portland,Portland,0.0,0,0,22,0,Portland,0.0,0.0,0.0,37,-12,False,False,False,1,0.488914248451,0.130559555438,0.480912162162,0.144801473598,0.258763543658,0.262678803641,0.210629279426,0.219594594595,0.737321196359,0.741236456342,-6.0,-6.5,-105.0,-105.0,193.0,195.5,-105.0,-105.0,190.0,231.0,-212.0,-260.0
94,94,6.75,20.125,19.0,4.1,35.25,81.4,20.325,26.325,12.5,32.0,18.75,97.575,7.3,15.175,44.5,1,42.725,5.9,17.575,20.625,5.65,37.325,84.15,15.8,21.5,96.35,11.575,31.15,8.65,22.675,13.45,Minnesota,3/7/2012_Minnesota_Portland,2012-03-07,2.0,Minneapolis,0.0,2,0,Minneapolis,0.0,2.0,0.0,40,False,False,False,0,0.474508599509,0.140303999704,0.478609625668,0.125630487577,0.28636884307,0.265633964429,0.249692874693,0.187759952466,0.734366035571,0.71363115693,6.66666666667,20.0769230769,21.8974358974,5.33333333333,37.1538461538,82.8717948718,17.1025641026,21.8461538462,10.9230769231,30.6153846154,20.3846153846,98.0769230769,8.64102564103,13.7179487179,41.5384615385,0,42.3333333333,5.92307692308,17.9487179487,19.5897435897,4.92307692308,35.4358974359,79.6923076923,17.4871794872,23.5384615385,94.2820512821,10.9487179487,31.3846153846,7.48717948718,20.6153846154,15.1794871795,192.358974359,0,Portland,2012-03-07,2.0,Minneapolis,Minneapolis,0.0,2,0,19,2,Portland,,0.0,2.0,39,-12,False,False,False,1,0.488551980198,0.12916839696,0.481821106821,0.144252324607,0.258181818182,0.26341764343,0.206373762376,0.219433719434,0.73658235657,0.741818181818,-2.0,1.0,-107.0,-103.0,196.0,195.5,102.0,-113.0,-101.0,-113.0,-109.0,102.0
95,95,6.7380952381,20.1904761905,19.0,4.11904761905,35.2380952381,81.3571428571,20.2619047619,26.2857142857,12.5238095238,31.7857142857,18.7857142857,97.4761904762,7.28571428571,15.1666666667,44.3095238095,0,42.619047619,5.83333333333,17.3333333333,20.8333333333,5.64285714286,37.4047619048,84.119047619,15.880952381,21.5,96.5238095238,11.619047619,31.0,8.52380952381,22.5,13.5,Minnesota,3/10/2012_Minnesota_New Orleans,2012-03-10,1.0,Minneapolis,0.0,2,0,Minneapolis,0.0,2.0,0.0,42,True,False,False,0,0.474539069359,0.140315787619,0.479337673365,0.126075084717,0.287746170678,0.267690619857,0.249048873281,0.188791395415,0.732309380143,0.712253829322,3.85365853659,12.1219512195,20.243902439,4.58536585366,34.6097560976,78.8780487805,15.5365853659,20.7073170732,11.7804878049,29.9512195122,20.7073170732,88.6097560976,7.26829268293,14.3414634146,41.7317073171,1,40.512195122,6.26829268293,19.8292682927,20.3902439024,5.92682926829,34.7804878049,77.5365853659,18.0243902439,23.8292682927,93.8536585366,10.8048780488,29.7073170732,7.90243902439,18.5853658537,13.4634146341,182.463414634,0,New Orleans,2012-03-10,1.0,Minneapolis,Minneapolis,0.0,2,2,20,0,Denver,,1.0,1.0,41,6,True,True,False,1,0.463203463203,0.140148156623,0.488990248506,0.132664244102,0.283950617284,0.265110712148,0.19696969697,0.232463038691,0.734889287852,0.716049382716,-9.0,-8.0,-117.0,106.0,189.0,189.0,-101.0,-109.0,393.0,312.0,-460.0,-358.0
96,96,6.90697674419,20.2325581395,19.2558139535,4.09302325581,35.5813953488,81.5348837209,20.0930232558,26.1627906977,12.511627907,31.6744186047,18.8604651163,98.1627906977,7.20930232558,15.0697674419,44.1860465116,1,42.488372093,5.90697674419,17.4186046512,20.9069767442,5.67441860465,37.6046511628,84.2325581395,16.0465116279,21.6744186047,97.1627906977,11.5813953488,30.9069767442,8.48837209302,22.4186046512,13.3488372093,Minnesota,3/12/2012_Phoenix_Minnesota,2012-03-12,2.0,Minneapolis,,2,-1,Minneapolis,,2.0,-1.0,43,False,False,False,0,0.478750713063,0.139384813938,0.481501932634,0.124617896346,0.288162828066,0.267741935484,0.2464346834,0.190502484815,0.732258064516,0.711837171934,6.48780487805,19.2195121951,22.3902439024,5.56097560976,36.8536585366,81.756097561,15.4146341463,20.1707317073,10.6341463415,31.5853658537,18.756097561,95.6097560976,6.78048780488,14.0,42.2195121951,0,43.6341463415,6.43902439024,17.8780487805,21.4390243902,4.46341463415,37.2926829268,83.4146341463,16.2682926829,21.3658536585,97.2926829268,11.9756097561,31.6585365854,8.26829268293,19.1951219512,13.4390243902,192.902439024,1,Phoenix,2012-03-12,2.0,Phoenix,Phoenix,0.0,1,1,19,0,Phoenix,0.0,1.0,0.0,41,-3,False,False,False,1,0.490453460621,0.133803276549,0.48567251462,0.126479418975,0.251441753172,0.274916013438,0.188544152745,0.195029239766,0.725083986562,0.748558246828,-4.0,-3.5,-103.0,-107.0,198.0,198.5,-104.0,-106.0,144.0,145.0,-160.0,-161.0
97,97,6.95454545455,20.3863636364,19.3181818182,4.11363636364,35.5909090909,81.5681818182,20.1818181818,26.3181818182,12.4318181818,31.8181818182,18.9318181818,98.3181818182,7.22727272727,15.1136363636,44.25,0,42.7727272727,5.88636363636,17.3181818182,20.9318181818,5.68181818182,37.7272727273,84.6590909091,16.1363636364,21.7954545455,97.4772727273,11.7045454545,31.0681818182,8.59090909091,22.4318181818,13.2954545455,Minnesota,3/15/2012_Utah_Minnesota,2012-03-15,1.0,Minneapolis,,2,-1,Phoenix,,1.0,0.0,44,False,False,False,0,0.478963499582,0.139602646782,0.480402684564,0.123627418659,0.28578892372,0.268929503916,0.247422680412,0.190604026846,0.731070496084,0.71421107628,3.74418604651,12.0697674419,21.0697674419,5.53488372093,37.6279069767,82.7441860465,18.5581395349,24.6744186047,12.6511627907,29.976744186,22.023255814,97.5581395349,8.41860465116,13.488372093,42.6279069767,1,40.511627907,6.11627906977,17.9069767442,20.2325581395,5.83720930233,36.3720930233,79.023255814,19.6046511628,26.0930232558,98.4651162791,10.8139534884,29.6976744186,7.55813953488,20.488372093,14.0697674419,196.023255814,1,Utah,2012-03-15,3.0,Salt Lake City,Salt Lake City,0.0,1,1,20,0,Phoenix,,1.0,0.0,43,6,True,True,False,1,0.477374929736,0.125954430556,0.498969982343,0.134543707802,0.298736957716,0.265108323831,0.224283305228,0.248087110065,0.734891676169,0.701263042284,-3.5,-2.5,100.0,-110.0,201.0,205.0,-110.0,100.0,127.0,120.0,-140.0,-133.0
98,98,6.86956521739,20.5217391304,19.3260869565,4.08695652174,35.6739130435,82.0217391304,19.9782608696,25.9782608696,12.652173913,31.9782608696,18.9782608696,98.1956521739,7.17391304348,15.1739130435,44.6304347826,0,42.847826087,6.02173913043,17.652173913,20.9347826087,5.78260869565,37.7608695652,84.8043478261,16.3043478261,21.8913043478,97.847826087,11.6739130435,31.1739130435,8.60869565217,22.1956521739,13.2391304348,Minnesota,3/18/2012_Sacramento_Minnesota,2012-03-18,2.0,Minneapolis,,2,-2,Los Angeles,,0.0,0.0,46,False,False,False,0,0.47680890538,0.139689401217,0.480774160472,0.122953798445,0.28869047619,0.267430278884,0.243572753777,0.192258395283,0.732569721116,0.71130952381,6.64444444444,20.6222222222,18.3111111111,4.46666666667,36.3555555556,85.6222222222,17.6666666667,23.3777777778,13.4,29.6444444444,19.4888888889,97.0222222222,8.17777777778,14.0222222222,43.0444444444,1,44.9111111111,6.55555555556,18.6666666667,23.4,6.26666666667,40.1111111111,84.5555555556,16.2666666667,21.4666666667,103.044444444,12.2888888889,32.6222222222,8.13333333333,20.1777777778,14.6,200.066666667,1,Sacramento,2012-03-18,2.0,Sacramento,Sacramento,0.0,0,0,19,0,Sacramento,0.0,0.0,0.0,45,16,False,False,False,1,0.463405138853,0.12755514587,0.513140604468,0.134437205343,0.291163689039,0.293057763646,0.206332727745,0.192378449409,0.706942236354,0.708836310961,-1.0,1.5,103.0,-114.0,209.5,212.5,-108.0,-102.0,-105.0,-110.0,-105.0,100.0
99,99,6.91489361702,20.5319148936,19.4255319149,4.10638297872,35.6595744681,81.8510638298,19.9361702128,25.914893617,12.5744680851,32.1276595745,18.8723404255,98.170212766,7.12765957447,15.1914893617,44.7021276596,1,42.6382978723,6.10638297872,17.829787234,20.9574468085,5.76595744681,37.6808510638,84.7021276596,16.2765957447,21.8510638298,97.7446808511,11.5531914894,31.085106383,8.6170212766,22.1489361702,13.1276595745,Minnesota,3/19/2012_Golden State_Minnesota,2012-03-19,2.0,Minneapolis,,2,-2,Sacramento,,0.0,0.0,47,True,True,True,0,0.477904860931,0.140084600111,0.480909319267,0.122181121136,0.288011695906,0.264490988797,0.243566415389,0.192162773173,0.735509011203,0.711988304094,8.06976744186,20.9534883721,21.9069767442,5.41860465116,37.2093023256,81.511627907,15.6046511628,20.4418604651,9.97674418605,29.976744186,21.9302325581,98.0930232558,8.39534883721,13.6744186047,39.9534883721,0,45.5813953488,7.0,18.9302325581,22.4186046512,4.27906976744,36.488372093,81.5581395349,19.8604651163,26.8139534884,99.8372093023,12.9534883721,32.6279069767,7.74418604651,17.6279069767,14.7906976744,197.930232558,1,Golden State,2012-03-19,1.0,Oakland,Oakland,0.0,0,0,19,0,Salt Lake City,,1.0,-1.0,43,-4,False,False,False,1,0.505991440799,0.131257031627,0.490305104078,0.136764781778,0.234170305677,0.30173347779,0.191440798859,0.243512974052,0.69826652221,0.765829694323,-1.0,-1.5,-102.0,-108.0,205.5,203.0,-102.0,-108.0,111.0,107.0,-123.0,-118.0
100,100,6.91666666667,20.5625,19.4375,4.10416666667,35.7291666667,81.9791666667,19.8333333333,25.7916666667,12.5,32.125,18.875,98.2083333333,7.14583333333,15.1666666667,44.625,0,42.9166666667,6.125,17.8541666667,21.125,5.70833333333,37.8333333333,84.9166666667,16.3333333333,21.9166666667,98.125,11.6666666667,31.25,8.64583333333,22.125,13.1458333333,Minnesota,3/21/2012_San Antonio_Minnesota,2012-03-21,4.0,Minneapolis,,2,0,Oakland,,0.0,2.0,48,False,False,False,0,0.478017789072,0.13979246196,0.481599607458,0.12205312309,0.285714285714,0.266412940057,0.241931385006,0.192345436703,0.733587059943,0.714285714286,8.31818181818,20.7727272727,22.4772727273,4.29545454545,38.5227272727,82.5,15.7727272727,21.9318181818,10.1363636364,32.0,17.4090909091,101.136363636,7.0,12.9090909091,42.1363636364,1,41.9545454545,6.68181818182,18.5,19.5681818182,5.0,37.9545454545,83.5681818182,14.25,18.8409090909,96.8409090909,10.1363636364,31.8181818182,7.38636363636,19.4545454545,12.8409090909,197.977272727,1,San Antonio,2012-03-21,2.0,San Antonio,San Antonio,0.0,2,2,20,0,Dallas,,2.0,0.0,44,16,False,False,False,1,0.517355371901,0.122874572751,0.494152841991,0.12264585088,0.241603466956,0.240560949299,0.191184573003,0.1705194452,0.759439050701,0.758396533044,-9.5,-9.5,-105.0,-105.0,207.0,208.0,-107.0,-103.0,442.0,457.0,-525.0,-545.0
101,101,7.0612244898,20.8775510204,19.5306122449,4.10204081633,36.0,82.3469387755,20.0,26.0,12.4693877551,32.1224489796,18.8367346939,99.0612244898,7.12244897959,15.2040816327,44.5918367347,0,43.0612244898,6.20408163265,18.0408163265,21.1836734694,5.73469387755,38.2857142857,85.4897959184,16.387755102,21.8775510204,99.1632653061,11.6530612245,31.4081632653,8.71428571429,22.2040816327,13.1224489796,Minnesota,3/23/2012_Oklahoma City_Minnesota,2012-03-23,2.0,Minneapolis,,2,0,San Antonio,,2.0,0.0,49,False,False,False,0,0.480049566295,0.13949847956,0.48412508952,0.121236575359,0.284186046512,0.2662004662,0.242874845105,0.19169252805,0.7337995338,0.715813953488,7.3125,20.5625,18.4583333333,7.91666666667,37.4583333333,78.7916666667,21.4166666667,26.875,10.7916666667,32.7291666667,20.375,103.645833333,7.5625,16.1666666667,43.5208333333,1,41.1458333333,6.41666666667,18.7708333333,20.4375,4.58333333333,36.6666666667,85.2916666667,17.6666666667,22.7916666667,97.4166666667,12.5833333333,28.5625,8.3125,20.25,13.7291666667,201.0625,1,Oklahoma City,2012-03-23,2.0,Oklahoma City,Oklahoma City,0.0,2,2,22,0,Oklahoma City,0.0,2.0,0.0,48,9,False,False,False,1,0.521813855103,0.15139690963,0.467513434294,0.125898868248,0.274219163579,0.277701149425,0.271813855103,0.207132388862,0.722298850575,0.725780836421,-10.5,-10.0,-106.0,-104.0,210.5,210.0,102.0,-113.0,516.0,516.0,-625.0,-625.0
102,102,7.16,21.16,19.64,4.12,36.18,82.68,19.9,25.78,12.58,31.96,18.84,99.42,7.1,15.08,44.54,1,43.04,6.14,17.98,21.14,5.68,38.34,85.4,16.36,21.88,99.18,11.64,31.4,8.62,22.12,13.18,Minnesota,3/25/2012_Minnesota_Denver,2012-03-25,2.0,Minneapolis,0.0,2,0,Oklahoma City,,2.0,0.0,50,False,False,False,0,0.480890179003,0.138217760799,0.484894613583,0.121803355045,0.286039108686,0.266972477064,0.24068698597,0.191569086651,0.733027522936,0.713960891314,6.57142857143,20.3469387755,23.5714285714,5.12244897959,38.2653061224,81.5102040816,20.5306122449,27.8979591837,11.0816326531,32.387755102,19.6734693878,103.632653061,8.40816326531,15.4693877551,43.4693877551,0,40.612244898,8.4693877551,22.387755102,23.4693877551,6.40816326531,39.0,84.612244898,16.0204081633,20.8979591837,102.489795918,10.6326530612,29.9795918367,8.28571428571,22.7551020408,15.0,206.12244898,0,Denver,2012-03-25,2.0,Minneapolis,Minneapolis,0.0,2,1,21,1,Salt Lake City,,1.0,1.0,49,-17,False,False,False,1,0.50976464697,0.141590143234,0.510974433189,0.137858337897,0.269880715706,0.24715370019,0.251877816725,0.189339122045,0.75284629981,0.730119284294,-1.0,-1.5,100.0,-110.0,212.0,210.0,-110.0,100.0,100.0,118.0,-110.0,-130.0
103,103,7.19607843137,21.3137254902,19.5098039216,4.19607843137,36.1176470588,82.7254901961,19.7254901961,25.5294117647,12.568627451,31.8823529412,18.8823529412,99.1568627451,7.09803921569,15.0392156863,44.4509803922,0,43.1568627451,6.01960784314,17.8431372549,21.0392156863,5.74509803922,38.2549019608,85.2941176471,16.5294117647,22.0,99.0588235294,11.6862745098,31.4705882353,8.62745098039,21.9803921569,13.2156862745,Minnesota,3/27/2012_Memphis_Minnesota,2012-03-27,2.0,Minneapolis,,2,0,Minneapolis,,2.0,0.0,51,False,False,False,0,0.480090068737,0.137977434303,0.483793103448,0.122152788853,0.285396260018,0.268226822682,0.238445129178,0.193793103448,0.731773177318,0.714603739982,3.85416666667,11.8958333333,20.0416666667,5.22916666667,37.0,82.3541666667,17.375,23.0416666667,12.1875,29.75,20.0625,95.2291666667,9.9375,14.375,41.9375,1,41.0,6.54166666667,18.4791666667,19.7083333333,5.75,34.6666666667,78.1041666667,17.9375,23.5416666667,93.8125,11.1041666667,29.8958333333,7.875,19.8958333333,16.7291666667,189.041666667,1,Memphis,2012-03-27,2.0,Memphis,Memphis,0.0,2,2,22,0,Los Angeles,,0.0,2.0,48,7,False,False,False,1,0.472678977991,0.134512363441,0.485729527874,0.159035094668,0.289603960396,0.271800101989,0.210979003289,0.229661242998,0.728199898011,0.710396039604,-5.5,-4.5,-104.0,-106.0,200.0,201.5,-108.0,-102.0,193.0,173.0,-215.0,-193.0
104,104,7.21153846154,21.3076923077,19.5576923077,4.17307692308,36.0576923077,82.6923076923,19.6153846154,25.4230769231,12.5769230769,31.9807692308,18.8461538462,98.9423076923,7.01923076923,15.0,44.5576923077,1,43.0576923077,5.96153846154,17.75,21.0576923077,5.67307692308,38.1153846154,85.1538461538,16.5576923077,22.0,98.75,11.5769230769,31.4807692308,8.55769230769,21.9615384615,13.1346153846,Minnesota,3/28/2012_Charlotte_Minnesota,2012-03-28,2.0,Minneapolis,,2,1,Memphis,,2.0,1.0,52,True,True,True,0,0.479651162791,0.137768294923,0.48261065944,0.121652334371,0.285464862505,0.265783664459,0.237209302326,0.194444444444,0.734216335541,0.714535137495,4.02083333333,13.4583333333,20.2916666667,5.66666666667,33.4166666667,80.375,16.625,22.1875,10.1458333333,29.0625,19.375,87.4791666667,6.1875,13.4166666667,39.2083333333,0,45.3541666667,6.1875,17.375,22.7083333333,5.89583333333,38.4583333333,81.9583333333,17.3125,23.1666666667,100.416666667,12.1041666667,33.25,7.4375,20.0208333333,13.1875,187.895833333,1,Charlotte,2012-03-28,1.0,Charlotte,Charlotte,0.0,3,3,20,0,Charlotte,0.0,3.0,0.0,48,-5,False,False,False,1,0.440772420943,0.129561823522,0.50699034062,0.125190851772,0.233797407585,0.294028340081,0.206842923795,0.211235383833,0.705971659919,0.766202592415,5.5,5.5,-101.0,-109.0,200.0,202.0,-105.0,-105.0,-218.0,-215.0,195.0,193.0
105,105,7.18867924528,21.358490566,19.4716981132,4.11320754717,35.8679245283,82.5471698113,19.641509434,25.4150943396,12.6037735849,31.9622641509,18.7358490566,98.5660377358,6.98113207547,15.0943396226,44.5660377358,0,43.0943396226,5.92452830189,17.641509434,21.2075471698,5.62264150943,38.2264150943,85.2452830189,16.3962264151,21.7924528302,98.7735849057,11.6037735849,31.4905660377,8.56603773585,21.9622641509,13.0566037736,Minnesota,3/30/2012_Minnesota_Boston,2012-03-30,2.0,Minneapolis,0.0,2,0,Charlotte,,3.0,-1.0,53,False,False,False,0,0.478057142857,0.138703950289,0.483178397521,0.121017103284,0.285836542576,0.266349068861,0.237942857143,0.192341744135,0.733650931139,0.714163457424,5.41176470588,15.0588235294,23.6470588235,5.64705882353,35.2745098039,77.1176470588,15.6274509804,20.0784313725,7.94117647059,30.431372549,20.2941176471,91.5882352941,7.21568627451,14.1176470588,38.3725490196,1,43.2941176471,4.98039215686,16.3529411765,18.7058823529,4.64705882353,33.6862745098,79.8823529412,17.8235294118,23.3725490196,90.1764705882,11.9607843137,31.3333333333,7.98039215686,18.8823529412,14.5098039216,181.764705882,0,Boston,2012-03-30,2.0,Minneapolis,Minneapolis,0.0,2,3,15,-1,Boston,,3.0,-1.0,51,21,False,False,False,1,0.492499364353,0.141077992617,0.452871870398,0.138616235333,0.202196704943,0.282146160962,0.202644291889,0.223122238586,0.717853839038,0.797803295057,-1.5,1.0,105.0,-116.0,191.0,190.0,-102.0,-108.0,100.0,100.0,-110.0,-110.0
106,106,7.14814814815,21.3518518519,19.4074074074,4.11111111111,35.8703703704,82.462962963,19.8148148148,25.5925925926,12.5185185185,31.8888888889,18.7407407407,98.7037037037,6.98148148148,14.962962963,44.4074074074,0,43.1111111111,5.98148148148,17.8333333333,21.2222222222,5.59259259259,38.3703703704,85.2962962963,16.4259259259,21.7592592593,99.1481481481,11.6296296296,31.4814814815,8.46296296296,21.9444444444,13.0,Minnesota,4/1/2012_Portland_Minnesota,2012-04-01,2.0,Minneapolis,,2,-2,Minneapolis,,2.0,-2.0,54,False,False,False,0,0.478329216259,0.137670640032,0.484910985671,0.120515021459,0.284511784512,0.267234042553,0.240287446665,0.192574902301,0.732765957447,0.715488215488,6.98113207547,20.4905660377,20.641509434,5.05660377358,36.4339622642,81.7169811321,17.320754717,21.8679245283,10.9811320755,29.6981132075,19.7358490566,97.1698113208,8.1320754717,13.679245283,40.679245283,1,41.8679245283,6.39622641509,18.3018867925,20.5660377358,4.71698113208,36.4716981132,79.7169811321,16.8490566038,22.8301886792,96.1886792453,10.7924528302,31.0754716981,7.49056603774,20.2452830189,14.4150943396,193.358490566,1,Portland,2012-04-01,2.0,Portland,Portland,0.0,0,0,20,0,Los Angeles,,0.0,0.0,53,13,False,False,False,1,0.488570768876,0.130256056457,0.497633136095,0.138370703083,0.261103633917,0.266542404473,0.211960286308,0.211360946746,0.733457595527,0.738896366083,-1.5,-3.5,-104.0,-106.0,196.0,199.0,-105.0,-105.0,120.0,144.0,-133.0,-160.0
107,107,7.21818181818,21.3454545455,19.4727272727,4.10909090909,35.9272727273,82.4363636364,19.8,25.6,12.4909090909,31.7454545455,18.8,98.8727272727,6.96363636364,14.8909090909,44.2363636364,0,43.1636363636,6.0,17.9272727273,21.2363636364,5.58181818182,38.4545454545,85.2909090909,16.5454545455,21.8727272727,99.4545454545,11.6545454545,31.5090909091,8.45454545455,21.9272727273,12.9636363636,Minnesota,4/2/2012_Sacramento_Minnesota,2012-04-02,2.0,Minneapolis,,2,-2,Portland,,0.0,0.0,55,True,True,True,0,0.479598588443,0.137128046453,0.486037092304,0.120168809368,0.283884297521,0.268537913699,0.240185266873,0.193988488595,0.731462086301,0.716115702479,6.32075471698,20.1886792453,18.8490566038,4.71698113208,37.320754717,86.5094339623,17.7547169811,23.6603773585,13.7169811321,29.7547169811,19.5849056604,98.7169811321,8.33962264151,14.0566037736,43.4716981132,1,44.8679245283,6.54716981132,18.7924528302,23.7169811321,6.2641509434,40.358490566,85.1886792453,16.7547169811,22.0,104.018867925,12.4905660377,32.3773584906,7.90566037736,20.5283018868,14.6603773585,202.735849057,1,Sacramento,2012-04-02,1.0,Sacramento,Sacramento,0.0,0,0,20,0,Sacramento,0.0,0.0,0.0,53,8,False,False,False,1,0.467938931298,0.126662767607,0.512181616833,0.133849206896,0.297584936553,0.295667708799,0.205234460196,0.196677740864,0.704332291201,0.702415063447,-2.0,-3.0,-102.0,-108.0,215.0,217.5,100.0,-110.0,143.0,137.0,-158.0,-151.0
